"No.","Time","Source","Destination","Protocol","Length","Flags","Window","Differentiated Services Field","Version","Info"
"1","0.000000000","HeightsTelec_bb:60:dc","Broadcast","ARP","60","","","","","Who has 169.254.170.91? Tell 10.0.0.138"
"2","0.102693231","HeightsTelec_bb:60:dc","Broadcast","ARP","60","","","","","Who has 10.0.0.6? Tell 10.0.0.138"
"3","0.102746499","VMware_fb:1e:36","HeightsTelec_bb:60:dc","ARP","42","","","","","10.0.0.6 is at 00:0c:29:fb:1e:36"
"4","0.205383825","HeightsTelec_bb:60:dc","Broadcast","ARP","60","","","","","Who has 10.0.0.2? Tell 10.0.0.138"
"5","0.314053290","10.0.0.138","10.0.0.6","NBNS","92","","","0x00","","Name query NBSTAT *<00><00><00><00><00><00><00><00><00><00><00><00><00><00><00>"
"6","0.314357059","10.0.0.6","10.0.0.138","ICMP","120","","","0xc0,0x00","","Destination unreachable (Port unreachable)"
"7","0.512104766","HeightsTelec_bb:60:dc","Broadcast","ARP","60","","","","","Who has 10.0.0.28? Tell 10.0.0.138"
"8","0.614277182","HeightsTelec_bb:60:dc","Broadcast","ARP","60","","","","","Who has 169.254.19.152? Tell 10.0.0.138"
"9","0.716746450","HeightsTelec_bb:60:dc","Broadcast","ARP","60","","","","","Who has 10.0.0.20? Tell 10.0.0.138"
"10","0.819691522","HeightsTelec_bb:60:dc","Broadcast","ARP","60","","","","","Who has 10.0.0.14? Tell 10.0.0.138"
"11","1.024018275","HeightsTelec_bb:60:dc","Broadcast","ARP","60","","","","","Who has 169.254.90.215? Tell 10.0.0.138"
"12","1.331885794","HeightsTelec_bb:60:dc","Broadcast","ARP","60","","","","","Who has 10.175.108.169? Tell 10.0.0.138"
"13","1.536875864","HeightsTelec_bb:60:dc","Broadcast","ARP","60","","","","","Who has 10.0.0.15? Tell 10.0.0.138"
"14","1.638897578","HeightsTelec_bb:60:dc","Broadcast","ARP","60","","","","","Who has 10.0.0.33? Tell 10.0.0.138"
"15","1.843065245","HeightsTelec_bb:60:dc","Broadcast","ARP","60","","","","","Who has 10.0.0.5? Tell 10.0.0.138"
"16","1.946276738","HeightsTelec_bb:60:dc","Broadcast","ARP","60","","","","","Who has 10.0.0.4? Tell 10.0.0.138"
"17","2.048145617","HeightsTelec_bb:60:dc","Broadcast","ARP","60","","","","","Who has 10.0.0.3? Tell 10.0.0.138"
"18","2.150512971","HeightsTelec_bb:60:dc","Broadcast","ARP","60","","","","","Who has 10.0.0.8? Tell 10.0.0.138"
"19","2.227667815","10.0.0.6","10.0.0.138","DNS","85","","","0x00","","Standard query 0xb595 HTTPS www.reddit.com OPT"
"20","2.228031063","10.0.0.6","10.0.0.138","DNS","85","","","0x00","","Standard query 0xa05d A www.reddit.com OPT"
"21","2.228197342","10.0.0.6","10.0.0.138","DNS","85","","","0x00","","Standard query 0x212f AAAA www.reddit.com OPT"
"22","2.245597750","10.0.0.138","10.0.0.6","DNS","101","","","0x00","","Standard query response 0xa05d A www.reddit.com A 199.232.169.140 OPT"
"23","2.249694895","10.0.0.138","10.0.0.6","DNS","178","","","0x00","","Standard query response 0xb595 HTTPS www.reddit.com CNAME reddit.map.fastly.net SOA ns1.fastly.net OPT"
"24","2.250060205","10.0.0.6","10.0.0.138","DNS","92","","","0x00","","Standard query 0xaa46 HTTPS reddit.map.fastly.net OPT"
"25","2.252221176","HeightsTelec_bb:60:dc","Broadcast","ARP","60","","","","","Who has 10.0.0.25? Tell 10.0.0.138"
"26","2.255103240","10.0.0.138","10.0.0.6","DNS","178","","","0x00","","Standard query response 0x212f AAAA www.reddit.com CNAME reddit.map.fastly.net SOA ns1.fastly.net OPT"
"27","2.255818611","10.0.0.6","10.0.0.138","DNS","92","","","0x00","","Standard query 0xcd8b AAAA reddit.map.fastly.net OPT"
"28","2.282625582","10.0.0.138","10.0.0.6","DNS","153","","","0x00","","Standard query response 0xaa46 HTTPS reddit.map.fastly.net SOA ns1.fastly.net OPT"
"29","2.282627538","10.0.0.138","10.0.0.6","DNS","153","","","0x00","","Standard query response 0xcd8b AAAA reddit.map.fastly.net SOA ns1.fastly.net OPT"
"30","2.287691715","10.0.0.6","10.0.0.138","DNS","92","","","0x00","","Standard query 0xd5b9 AAAA reddit.map.fastly.net OPT"
"31","2.301136082","10.0.0.138","10.0.0.6","DNS","153","","","0x00","","Standard query response 0xd5b9 AAAA reddit.map.fastly.net SOA ns1.fastly.net OPT"
"32","2.301793896","10.0.0.6","199.232.169.140","TCP","74","0x002","64240","0x00","","37570  >  443 [SYN] Seq=0 Win=64240 Len=0 MSS=1460 SACK_PERM TSval=1381407809 TSecr=0 WS=128"
"33","2.302089420","10.0.0.6","199.232.169.140","TCP","74","0x002","64240","0x00","","37584  >  443 [SYN] Seq=0 Win=64240 Len=0 MSS=1460 SACK_PERM TSval=1381407809 TSecr=0 WS=128"
"34","2.305963206","10.0.0.6","199.232.169.140","TCP","74","0x002","64240","0x00","","37586  >  443 [SYN] Seq=0 Win=64240 Len=0 MSS=1460 SACK_PERM TSval=1381407813 TSecr=0 WS=128"
"35","2.356563456","HeightsTelec_bb:60:dc","Broadcast","ARP","60","","","","","Who has 10.0.0.27? Tell 10.0.0.138"
"36","2.381774362","199.232.169.140","10.0.0.6","TCP","74","0x012","65535","0x28","","443  >  37584 [SYN, ACK] Seq=0 Ack=1 Win=65535 Len=0 MSS=1452 SACK_PERM TSval=980206502 TSecr=1381407809 WS=512"
"37","2.381774764","199.232.169.140","10.0.0.6","TCP","74","0x012","65535","0x28","","443  >  37586 [SYN, ACK] Seq=0 Ack=1 Win=65535 Len=0 MSS=1452 SACK_PERM TSval=3279617858 TSecr=1381407813 WS=512"
"38","2.381774931","199.232.169.140","10.0.0.6","TCP","74","0x012","65535","0x28","","443  >  37570 [SYN, ACK] Seq=0 Ack=1 Win=65535 Len=0 MSS=1452 SACK_PERM TSval=1850675268 TSecr=1381407809 WS=512"
"39","2.381919949","10.0.0.6","199.232.169.140","TCP","66","0x010","502","0x00","","37584  >  443 [ACK] Seq=1 Ack=1 Win=64256 Len=0 TSval=1381407889 TSecr=980206502"
"40","2.382150543","10.0.0.6","199.232.169.140","TCP","66","0x010","502","0x00","","37586  >  443 [ACK] Seq=1 Ack=1 Win=64256 Len=0 TSval=1381407889 TSecr=3279617858"
"41","2.382315614","10.0.0.6","199.232.169.140","TCP","66","0x010","502","0x00","","37570  >  443 [ACK] Seq=1 Ack=1 Win=64256 Len=0 TSval=1381407889 TSecr=1850675268"
"42","2.383326893","10.0.0.6","199.232.169.140","TLSv1.3","1965","0x018","502","0x00","TLS 1.0","Client Hello (SNI=www.reddit.com)"
"43","2.384594478","10.0.0.6","199.232.169.140","TLSv1.3","1965","0x018","502","0x00","TLS 1.0","Client Hello (SNI=www.reddit.com)"
"44","2.385209240","10.0.0.6","199.232.169.140","TLSv1.3","1965","0x018","502","0x00","TLS 1.0","Client Hello (SNI=www.reddit.com)"
"45","2.449156654","199.232.169.140","10.0.0.6","TCP","66","0x010","291","0x28","","443  >  37584 [ACK] Seq=1 Ack=1900 Win=148992 Len=0 TSval=980206586 TSecr=1381407890"
"46","2.449156914","199.232.169.140","10.0.0.6","TCP","66","0x010","291","0x28","","443  >  37586 [ACK] Seq=1 Ack=1900 Win=148992 Len=0 TSval=3279617939 TSecr=1381407892"
"47","2.451149010","199.232.169.140","10.0.0.6","TLSv1.3","2864","0x018","291","0x28","TLS 1.2,TLS 1.2,TLS 1.2","Server Hello, Change Cipher Spec, Application Data"
"48","2.451149183","199.232.169.140","10.0.0.6","TLSv1.3","1512","0x018","291","0x28","TLS 1.2,TLS 1.2,TLS 1.2,TLS 1.2","Application Data, Application Data, Application Data, Application Data"
"49","2.451201571","10.0.0.6","199.232.169.140","TCP","66","0x010","545","0x00","","37584  >  443 [ACK] Seq=1900 Ack=2799 Win=69760 Len=0 TSval=1381407958 TSecr=980206588"
"50","2.451346030","10.0.0.6","199.232.169.140","TCP","66","0x010","567","0x00","","37584  >  443 [ACK] Seq=1900 Ack=4245 Win=72576 Len=0 TSval=1381407958 TSecr=980206588"
"51","2.453326641","199.232.169.140","10.0.0.6","TLSv1.3","2864","0x018","291","0x28","TLS 1.2,TLS 1.2,TLS 1.2","Server Hello, Change Cipher Spec, Application Data"
"52","2.453326841","199.232.169.140","10.0.0.6","TLSv1.3","1512","0x018","291","0x28","TLS 1.2,TLS 1.2,TLS 1.2,TLS 1.2","Application Data, Application Data, Application Data, Application Data"
"53","2.453342372","10.0.0.6","199.232.169.140","TCP","66","0x010","545","0x00","","37586  >  443 [ACK] Seq=1900 Ack=2799 Win=69760 Len=0 TSval=1381407960 TSecr=3279617942"
"54","2.453444668","10.0.0.6","199.232.169.140","TCP","66","0x010","567","0x00","","37586  >  443 [ACK] Seq=1900 Ack=4245 Win=72576 Len=0 TSval=1381407960 TSecr=3279617942"
"55","2.456041420","10.0.0.6","199.232.169.140","TLSv1.3","130","0x018","567","0x00","TLS 1.2,TLS 1.2","Change Cipher Spec, Application Data"
"56","2.456370481","10.0.0.6","199.232.169.140","TLSv1.3","130","0x018","567","0x00","TLS 1.2,TLS 1.2","Change Cipher Spec, Application Data"
"57","2.457119272","HeightsTelec_bb:60:dc","Broadcast","ARP","60","","","","","Who has 10.0.0.30? Tell 10.0.0.138"
"58","2.457208503","10.0.0.6","199.232.169.140","TLSv1.3","158","0x018","567","0x00","TLS 1.2","Application Data"
"59","2.457573203","10.0.0.6","199.232.169.140","TLSv1.3","393","0x018","567","0x00","TLS 1.2","Application Data"
"60","2.457740679","199.232.169.140","10.0.0.6","TCP","66","0x010","291","0x28","","443  >  37570 [ACK] Seq=1 Ack=1900 Win=148992 Len=0 TSval=1850675353 TSecr=1381407892"
"61","2.457939210","10.0.0.6","199.232.169.140","TLSv1.3","175","0x018","567","0x00","TLS 1.2","Application Data"
"62","2.458486934","199.232.169.140","10.0.0.6","TLSv1.3","2864","0x018","291","0x28","TLS 1.2,TLS 1.2,TLS 1.2","Server Hello, Change Cipher Spec, Application Data"
"63","2.458487013","199.232.169.140","10.0.0.6","TLSv1.3","1465","0x010","291","0x28","TLS 1.2,TLS 1.2,TLS 1.2","Application Data, Application Data, Application Data"
"64","2.458500644","10.0.0.6","199.232.169.140","TCP","66","0x010","545","0x00","","37570  >  443 [ACK] Seq=1900 Ack=2799 Win=69760 Len=0 TSval=1381407966 TSecr=1850675355"
"65","2.458647888","10.0.0.6","199.232.169.140","TCP","66","0x010","567","0x00","","37570  >  443 [ACK] Seq=1900 Ack=4198 Win=72576 Len=0 TSval=1381407966 TSecr=1850675355"
"66","2.460046404","10.0.0.6","199.232.169.140","TLSv1.3","90","0x018","567","0x00","TLS 1.2","Application Data"
"67","2.460202328","10.0.0.6","199.232.169.140","TCP","66","0x011","567","0x00","","37586  >  443 [FIN, ACK] Seq=2097 Ack=4245 Win=72576 Len=0 TSval=1381407967 TSecr=3279617942"
"68","2.460286354","199.232.169.140","10.0.0.6","TLSv1.3","113","0x018","291","0x28","TLS 1.2","Application Data"
"69","2.460296572","10.0.0.6","199.232.169.140","TCP","66","0x010","567","0x00","","37570  >  443 [ACK] Seq=1900 Ack=4245 Win=72576 Len=0 TSval=1381407967 TSecr=1850675355"
"70","2.460477671","10.0.0.6","199.232.169.140","TLSv1.3","130","0x018","567","0x00","TLS 1.2,TLS 1.2","Change Cipher Spec, Application Data"
"71","2.460760951","10.0.0.6","199.232.169.140","TLSv1.3","175","0x018","567","0x00","TLS 1.2","Application Data"
"72","2.461155251","10.0.0.6","199.232.169.140","TLSv1.3","90","0x018","567","0x00","TLS 1.2","Application Data"
"73","2.461239068","10.0.0.6","199.232.169.140","TCP","66","0x011","567","0x00","","37570  >  443 [FIN, ACK] Seq=2097 Ack=4245 Win=72576 Len=0 TSval=1381407968 TSecr=1850675355"
"74","2.562860040","199.232.169.140","10.0.0.6","TCP","66","0x010","291","0x28","","443  >  37586 [ACK] Seq=4245 Ack=2073 Win=148992 Len=0 TSval=3279618010 TSecr=1381407965"
"75","2.562860522","199.232.169.140","10.0.0.6","TLSv1.3","131","0x018","291","0x28","TLS 1.2","Application Data"
"76","2.562860584","199.232.169.140","10.0.0.6","TCP","66","0x010","291","0x28","","443  >  37586 [ACK] Seq=4310 Ack=2097 Win=148992 Len=0 TSval=3279618011 TSecr=1381407967"
"77","2.562860610","199.232.169.140","10.0.0.6","TLSv1.3","90","0x018","291","0x28","TLS 1.2","Application Data"
"78","2.563002779","10.0.0.6","199.232.169.140","TCP","54","0x004","0","0x28","","37586  >  443 [RST] Seq=2073 Win=0 Len=0"
"79","2.563352913","10.0.0.6","199.232.169.140","TCP","54","0x004","0","0x28","","37586  >  443 [RST] Seq=2097 Win=0 Len=0"
"80","2.563659929","10.0.0.6","199.232.169.140","TCP","54","0x004","0","0x28","","37586  >  443 [RST] Seq=2097 Win=0 Len=0"
"81","2.563906773","199.232.169.140","10.0.0.6","TCP","66","0x010","291","0x28","","[TCP Previous segment not captured] 443  >  37586 [ACK] Seq=4335 Ack=2098 Win=148992 Len=0 TSval=3279618011 TSecr=1381407967"
"82","2.563907040","199.232.169.140","10.0.0.6","TCP","66","0x011","291","0x28","","[TCP Out-Of-Order] 443  >  37586 [FIN, ACK] Seq=4334 Ack=2097 Win=148992 Len=0 TSval=3279618011 TSecr=1381407967"
"83","2.563907066","199.232.169.140","10.0.0.6","TCP","66","0x010","291","0x28","","443  >  37584 [ACK] Seq=4245 Ack=1964 Win=148992 Len=0 TSval=980206659 TSecr=1381407963"
"84","2.563907096","199.232.169.140","10.0.0.6","TCP","66","0x010","291","0x28","","443  >  37584 [ACK] Seq=4245 Ack=2056 Win=148992 Len=0 TSval=980206659 TSecr=1381407964"
"85","2.563907122","199.232.169.140","10.0.0.6","TCP","66","0x010","296","0x28","","443  >  37584 [ACK] Seq=4245 Ack=2383 Win=151552 Len=0 TSval=980206659 TSecr=1381407965"
"86","2.563907147","199.232.169.140","10.0.0.6","TLSv1.3","131","0x018","296","0x28","TLS 1.2","Application Data"
"87","2.563907172","199.232.169.140","10.0.0.6","TLSv1.3","898","0x018","296","0x28","TLS 1.2","Application Data"
"88","2.563907199","199.232.169.140","10.0.0.6","TLSv1.3","509","0x018","296","0x28","TLS 1.2","Application Data"
"89","2.563924149","10.0.0.6","199.232.169.140","TCP","54","0x004","0","0x28","","37586  >  443 [RST] Seq=2098 Win=0 Len=0"
"90","2.564038055","10.0.0.6","199.232.169.140","TCP","54","0x004","0","0x28","","37586  >  443 [RST] Seq=2097 Win=0 Len=0"
"91","2.564174658","199.232.169.140","10.0.0.6","TCP","66","0x010","291","0x28","","443  >  37570 [ACK] Seq=4245 Ack=1964 Win=148992 Len=0 TSval=1850675426 TSecr=1381407968"
"92","2.564174703","199.232.169.140","10.0.0.6","TCP","66","0x010","291","0x28","","443  >  37570 [ACK] Seq=4245 Ack=2073 Win=148992 Len=0 TSval=1850675428 TSecr=1381407968"
"93","2.564174730","199.232.169.140","10.0.0.6","TLSv1.3","131","0x018","291","0x28","TLS 1.2","Application Data"
"94","2.564174754","199.232.169.140","10.0.0.6","TCP","66","0x010","291","0x28","","443  >  37570 [ACK] Seq=4310 Ack=2097 Win=148992 Len=0 TSval=1850675429 TSecr=1381407968"
"95","2.564174779","199.232.169.140","10.0.0.6","TLSv1.3","90","0x018","291","0x28","TLS 1.2","Application Data"
"96","2.564174804","199.232.169.140","10.0.0.6","TCP","66","0x011","291","0x28","","443  >  37570 [FIN, ACK] Seq=4334 Ack=2098 Win=148992 Len=0 TSval=1850675429 TSecr=1381407968"
"97","2.564190587","10.0.0.6","199.232.169.140","TCP","54","0x004","0","0x28","","37570  >  443 [RST] Seq=2073 Win=0 Len=0"
"98","2.564247456","10.0.0.6","199.232.169.140","TCP","54","0x004","0","0x28","","37570  >  443 [RST] Seq=2097 Win=0 Len=0"
"99","2.564293420","10.0.0.6","199.232.169.140","TCP","54","0x004","0","0x28","","37570  >  443 [RST] Seq=2098 Win=0 Len=0"
"100","2.564366058","10.0.0.6","199.232.169.140","TCP","54","0x004","0","0x28","","37570  >  443 [RST] Seq=2098 Win=0 Len=0"
"101","2.564439409","10.0.0.6","199.232.169.140","TLSv1.3","97","0x018","611","0x00","TLS 1.2","Application Data"
"102","2.572802381","10.0.0.6","199.232.169.140","TLSv1.3","191","0x018","611","0x00","TLS 1.2","Application Data"
"103","2.667334716","199.232.169.140","10.0.0.6","TCP","66","0x010","296","0x28","","443  >  37584 [ACK] Seq=5585 Ack=2414 Win=151552 Len=0 TSval=980206766 TSecr=1381408071"
"104","2.667335052","199.232.169.140","10.0.0.6","TCP","66","0x010","296","0x28","","443  >  37584 [ACK] Seq=5585 Ack=2539 Win=151552 Len=0 TSval=980206782 TSecr=1381408080"
"105","2.765959066","HeightsTelec_bb:60:dc","Broadcast","ARP","60","","","","","Who has 10.0.0.10? Tell 10.0.0.138"
"106","2.856402359","199.232.169.140","10.0.0.6","TLSv1.3","1465","0x010","296","0x28","TLS 1.2","Application Data"
"107","2.857023445","199.232.169.140","10.0.0.6","TLSv1.3","1465","0x018","296","0x28","TLS 1.2","Application Data"
"108","2.857023655","199.232.169.140","10.0.0.6","TLSv1.3","1013","0x018","296","0x28","TLS 1.2","Application Data"
"109","2.857064116","10.0.0.6","199.232.169.140","TCP","66","0x010","655","0x00","","37584  >  443 [ACK] Seq=2539 Ack=8383 Win=83840 Len=0 TSval=1381408364 TSecr=980206894"
"110","2.864154503","199.232.169.140","10.0.0.6","TLSv1.3","2537","0x018","296","0x28","TLS 1.2,TLS 1.2","Application Data, Application Data"
"111","2.864154871","199.232.169.140","10.0.0.6","TLSv1.3","2864","0x018","296","0x28","TLS 1.2,TLS 1.2","Application Data, Application Data"
"112","2.864154896","199.232.169.140","10.0.0.6","TLSv1.3","2864","0x018","296","0x28","TLS 1.2,TLS 1.2","Application Data, Application Data"
"113","2.864154921","199.232.169.140","10.0.0.6","TLSv1.3","2864","0x018","296","0x28","TLS 1.2,TLS 1.2","Application Data, Application Data"
"114","2.864201795","10.0.0.6","199.232.169.140","TCP","66","0x010","675","0x00","","37584  >  443 [ACK] Seq=2539 Ack=11801 Win=86400 Len=0 TSval=1381408371 TSecr=980206894"
"115","2.864350185","10.0.0.6","199.232.169.140","TCP","66","0x010","654","0x00","","37584  >  443 [ACK] Seq=2539 Ack=14599 Win=83712 Len=0 TSval=1381408371 TSecr=980206972"
"116","2.864429796","199.232.169.140","10.0.0.6","TLSv1.3","2864","0x018","296","0x28","TLS 1.2,TLS 1.2","Application Data, Application Data"
"117","2.864429829","199.232.169.140","10.0.0.6","TLSv1.3","2864","0x018","296","0x28","TLS 1.2,TLS 1.2","Application Data, Application Data"
"118","2.864429983","199.232.169.140","10.0.0.6","TLSv1.3","1169","0x018","296","0x28","TLS 1.2,TLS 1.2,TLS 1.2","Application Data, Application Data, Application Data"
"119","2.864430011","199.232.169.140","10.0.0.6","TLSv1.3","2864","0x018","296","0x28","TLS 1.2,TLS 1.2","Application Data, Application Data"
"120","2.864452949","10.0.0.6","199.232.169.140","TCP","66","0x010","542","0x00","","37584  >  443 [ACK] Seq=2539 Ack=29692 Win=69376 Len=0 TSval=1381408371 TSecr=980206973"
"121","2.866581256","HeightsTelec_bb:60:dc","Broadcast","ARP","60","","","","","Who has 10.0.0.7? Tell 10.0.0.138"
"122","2.881881269","199.232.169.140","10.0.0.6","TLSv1.3","2864","0x018","296","0x28","TLS 1.2,TLS 1.2","Application Data, Application Data"
"123","2.881882267","199.232.169.140","10.0.0.6","TLSv1.3","2864","0x018","296","0x28","TLS 1.2,TLS 1.2","Application Data, Application Data"
"124","2.881882293","199.232.169.140","10.0.0.6","TLSv1.3","2864","0x018","296","0x28","TLS 1.2,TLS 1.2","Application Data, Application Data"
"125","2.881882319","199.232.169.140","10.0.0.6","TLSv1.3","2864","0x018","296","0x28","TLS 1.2,TLS 1.2","Application Data, Application Data"
"126","2.881977618","10.0.0.6","199.232.169.140","TCP","66","0x010","675","0x00","","37584  >  443 [ACK] Seq=2539 Ack=32490 Win=86400 Len=0 TSval=1381408389 TSecr=980206988"
"127","2.882192489","199.232.169.140","10.0.0.6","TLSv1.3","2864","0x018","296","0x28","TLS 1.2,TLS 1.2","Application Data, Application Data"
"128","2.882192549","199.232.169.140","10.0.0.6","TLSv1.3","1448","0x018","296","0x28","TLS 1.2,TLS 1.2","Application Data, Application Data"
"129","2.882216963","10.0.0.6","199.232.169.140","TCP","66","0x010","583","0x00","","37584  >  443 [ACK] Seq=2539 Ack=45064 Win=74624 Len=0 TSval=1381408389 TSecr=980206991"
"130","2.904264794","10.0.0.6","34.120.208.123","TCP","74","0x002","64240","0x00","","37562  >  443 [SYN] Seq=0 Win=64240 Len=0 MSS=1460 SACK_PERM TSval=518676200 TSecr=0 WS=128"
"131","2.920470488","34.120.208.123","10.0.0.6","TCP","74","0x012","65535","0x60","","443  >  37562 [SYN, ACK] Seq=0 Ack=1 Win=65535 Len=0 MSS=1412 SACK_PERM TSval=407186332 TSecr=518676200 WS=256"
"132","2.920522437","10.0.0.6","34.120.208.123","TCP","66","0x010","502","0x00","","37562  >  443 [ACK] Seq=1 Ack=1 Win=64256 Len=0 TSval=518676217 TSecr=407186332"
"133","2.921197581","10.0.0.6","34.120.208.123","TLSv1.3","1981","0x018","502","0x00","TLS 1.0","Client Hello (SNI=incoming.telemetry.mozilla.org)"
"134","2.926868060","199.232.169.140","10.0.0.6","TLSv1.3","1465","0x010","296","0x28","TLS 1.2","Application Data"
"135","2.934080708","34.120.208.123","10.0.0.6","TCP","66","0x010","1045","0x60","","443  >  37562 [ACK] Seq=1 Ack=1401 Win=267520 Len=0 TSval=407186349 TSecr=518676217"
"136","2.934080967","34.120.208.123","10.0.0.6","TCP","66","0x010","1043","0x60","","443  >  37562 [ACK] Seq=1 Ack=1916 Win=267008 Len=0 TSval=407186350 TSecr=518676217"
"137","2.934080992","34.120.208.123","10.0.0.6","TLSv1.3","1465","0x010","1043","0x60","TLS 1.2,TLS 1.2","Server Hello, Change Cipher Spec"
"138","2.934119182","10.0.0.6","34.120.208.123","TCP","66","0x010","524","0x00","","37562  >  443 [ACK] Seq=1916 Ack=1400 Win=67072 Len=0 TSval=518676230 TSecr=407186352"
"139","2.937779061","199.232.169.140","10.0.0.6","TLSv1.3","2864","0x018","296","0x28","TLS 1.2,TLS 1.2","Application Data, Application Data"
"140","2.937779323","199.232.169.140","10.0.0.6","TLSv1.3","1465","0x010","296","0x28","TLS 1.2","Application Data"
"141","2.937809777","10.0.0.6","199.232.169.140","TCP","66","0x010","675","0x00","","37584  >  443 [ACK] Seq=2539 Ack=49261 Win=86400 Len=0 TSval=1381408445 TSecr=980207050"
"142","2.940879295","199.232.169.140","10.0.0.6","TLSv1.3","1465","0x018","296","0x28","TLS 1.2","Application Data"
"143","2.940879651","34.120.208.123","10.0.0.6","TCP","715","0x018","1043","0x60","","443  >  37562 [PSH, ACK] Seq=1400 Ack=1916 Win=267008 Len=649 TSval=407186352 TSecr=518676217 [TCP PDU reassembled in 149]"
"144","2.940907372","10.0.0.6","199.232.169.140","TCP","66","0x010","707","0x00","","37584  >  443 [ACK] Seq=2539 Ack=52059 Win=90496 Len=0 TSval=1381408448 TSecr=980207061"
"145","2.941034671","10.0.0.6","34.120.208.123","TCP","66","0x010","546","0x00","","37562  >  443 [ACK] Seq=1916 Ack=2049 Win=69888 Len=0 TSval=518676237 TSecr=407186352"
"146","2.942934865","10.0.0.6","10.0.0.138","DNS","91","","","0x00","","Standard query 0x43a6 A www.redditstatic.com OPT"
"147","2.943194794","10.0.0.6","10.0.0.138","DNS","91","","","0x00","","Standard query 0x0486 HTTPS www.redditstatic.com OPT"
"148","2.943359485","10.0.0.6","10.0.0.138","DNS","91","","","0x00","","Standard query 0x60f4 AAAA www.redditstatic.com OPT"
"149","2.947105619","34.120.208.123","10.0.0.6","TLSv1.3","1528","0x018","1043","0x60","TLS 1.2","Application Data"
"150","2.947223902","10.0.0.6","34.120.208.123","TCP","66","0x010","569","0x00","","37562  >  443 [ACK] Seq=1916 Ack=3511 Win=72832 Len=0 TSval=518676243 TSecr=407186352"
"151","2.950539313","10.0.0.6","34.120.208.123","TLSv1.3","130","0x018","569","0x00","TLS 1.2,TLS 1.2","Change Cipher Spec, Application Data"
"152","2.953900563","10.0.0.6","34.120.208.123","TLSv1.3","158","0x018","569","0x00","TLS 1.2","Application Data"
"153","2.954171931","10.0.0.6","34.120.208.123","TLSv1.3","483","0x018","569","0x00","TLS 1.2","Application Data"
"154","2.954318457","10.0.0.6","34.120.208.123","TLSv1.3","1469","0x018","569","0x00","TLS 1.2","Application Data"
"155","2.963205769","199.232.169.140","10.0.0.6","TLSv1.3","2864","0x018","296","0x28","TLS 1.2,TLS 1.2","Application Data, Application Data"
"156","2.963206779","199.232.169.140","10.0.0.6","TLSv1.3","1465","0x010","296","0x28","TLS 1.2","Application Data"
"157","2.963278649","10.0.0.6","199.232.169.140","TCP","66","0x010","751","0x00","","37584  >  443 [ACK] Seq=2539 Ack=54857 Win=96128 Len=0 TSval=1381408470 TSecr=980207070"
"158","2.964608440","199.232.169.140","10.0.0.6","TLSv1.3","1465","0x018","296","0x28","TLS 1.2","Application Data"
"159","2.964609075","199.232.169.140","10.0.0.6","TLSv1.3","2864","0x018","296","0x28","TLS 1.2,TLS 1.2","Application Data, Application Data"
"160","2.964609104","199.232.169.140","10.0.0.6","TLSv1.3","2864","0x018","296","0x28","TLS 1.2,TLS 1.2","Application Data, Application Data"
"161","2.964609131","199.232.169.140","10.0.0.6","TCP","2864","0x018","296","0x28","","443  >  37584 [PSH, ACK] Seq=63251 Ack=2539 Win=151552 Len=2798 TSval=980207080 TSecr=1381408371 [TCP PDU reassembled in 169]"
"162","2.964609158","199.232.169.140","10.0.0.6","TCP","2864","0x018","296","0x28","","443  >  37584 [PSH, ACK] Seq=66049 Ack=2539 Win=151552 Len=2798 TSval=980207082 TSecr=1381408371 [TCP PDU reassembled in 169]"
"163","2.964708938","10.0.0.6","199.232.169.140","TCP","66","0x010","794","0x00","","37584  >  443 [ACK] Seq=2539 Ack=57655 Win=101632 Len=0 TSval=1381408472 TSecr=980207071"
"164","2.964994406","10.0.0.6","199.232.169.140","TCP","66","0x010","838","0x00","","37584  >  443 [ACK] Seq=2539 Ack=60453 Win=107264 Len=0 TSval=1381408472 TSecr=980207074"
"165","2.965061751","10.0.0.6","199.232.169.140","TCP","66","0x010","882","0x00","","37584  >  443 [ACK] Seq=2539 Ack=63251 Win=112896 Len=0 TSval=1381408472 TSecr=980207077"
"166","2.965105148","10.0.0.6","199.232.169.140","TCP","66","0x010","925","0x00","","37584  >  443 [ACK] Seq=2539 Ack=66049 Win=118400 Len=0 TSval=1381408472 TSecr=980207080"
"167","2.965162881","10.0.0.6","199.232.169.140","TCP","66","0x010","969","0x00","","37584  >  443 [ACK] Seq=2539 Ack=68847 Win=124032 Len=0 TSval=1381408472 TSecr=980207082"
"168","2.965243491","199.232.169.140","10.0.0.6","TCP","2864","0x018","296","0x28","","443  >  37584 [PSH, ACK] Seq=68847 Ack=2539 Win=151552 Len=2798 TSval=980207084 TSecr=1381408371 [TCP PDU reassembled in 169]"
"169","2.965243520","199.232.169.140","10.0.0.6","TLSv1.3","1072","0x018","296","0x28","TLS 1.2","Application Data"
"170","2.965253224","10.0.0.6","199.232.169.140","TCP","66","0x010","1013","0x00","","37584  >  443 [ACK] Seq=2539 Ack=71645 Win=129664 Len=0 TSval=1381408472 TSecr=980207084"
"171","2.970969868","34.120.208.123","10.0.0.6","TLSv1.3","684","0x018","1043","0x60","TLS 1.2,TLS 1.2","Application Data, Application Data"
"172","2.970970134","34.120.208.123","10.0.0.6","TLSv1.3","97","0x018","1043","0x60","TLS 1.2","Application Data"
"173","2.970970181","34.120.208.123","10.0.0.6","TCP","78","0x010","1042","0x60","","443  >  37562 [ACK] Seq=4160 Ack=2489 Win=266752 Len=0 TSval=407186384 TSecr=518676250 SLE=3889 SRE=3892"
"174","2.970970209","34.120.208.123","10.0.0.6","TCP","66","0x010","1037","0x60","","443  >  37562 [ACK] Seq=4160 Ack=3892 Win=265472 Len=0 TSval=407186384 TSecr=518676250"
"175","2.971565339","10.0.0.6","34.120.208.123","TLSv1.3","97","0x018","590","0x00","TLS 1.2","Application Data"
"176","2.976426893","10.0.0.138","10.0.0.6","DNS","194","","","0x00","","Standard query response 0x0486 HTTPS www.redditstatic.com CNAME dualstack.reddit.map.fastly.net SOA ns1.fastly.net OPT"
"177","2.976805641","10.0.0.6","10.0.0.138","DNS","102","","","0x00","","Standard query 0x9539 HTTPS dualstack.reddit.map.fastly.net OPT"
"178","3.004338624","199.232.169.140","10.0.0.6","TLSv1.3","823","0x018","296","0x28","TLS 1.2","Application Data"
"179","3.004339010","199.232.169.140","10.0.0.6","TCP","2864","0x018","296","0x28","","443  >  37584 [PSH, ACK] Seq=73408 Ack=2539 Win=151552 Len=2798 TSval=980207117 TSecr=1381408389 [TCP PDU reassembled in 180]"
"180","3.004339053","199.232.169.140","10.0.0.6","TLSv1.3","1029","0x018","296","0x28","TLS 1.2","Application Data"
"181","3.004378840","10.0.0.6","199.232.169.140","TCP","66","0x010","1057","0x00","","37584  >  443 [ACK] Seq=2539 Ack=73408 Win=135296 Len=0 TSval=1381408511 TSecr=980207086"
"182","3.004538257","10.0.0.6","199.232.169.140","TCP","66","0x010","1100","0x00","","37584  >  443 [ACK] Seq=2539 Ack=76206 Win=140800 Len=0 TSval=1381408512 TSecr=980207117"
"183","3.005560967","34.120.208.123","10.0.0.6","TCP","66","0x010","1037","0x60","","443  >  37562 [ACK] Seq=4160 Ack=3923 Win=265472 Len=0 TSval=407186415 TSecr=518676268"
"184","3.012797874","10.0.0.138","10.0.0.6","DNS","163","","","0x00","","Standard query response 0x9539 HTTPS dualstack.reddit.map.fastly.net SOA ns1.fastly.net OPT"
"185","3.019283024","10.0.0.138","10.0.0.6","DNS","224","","","0x00","","Standard query response 0x43a6 A www.redditstatic.com CNAME dualstack.reddit.map.fastly.net A 199.232.169.140 NS ns1.fastly.net NS ns2.fastly.net NS ns3.fastly.net NS ns4.fastly.net OPT"
"186","3.019928664","10.0.0.138","10.0.0.6","DNS","236","","","0x00","","Standard query response 0x60f4 AAAA www.redditstatic.com CNAME dualstack.reddit.map.fastly.net AAAA 2a04:4e42:6a::396 NS ns1.fastly.net NS ns2.fastly.net NS ns3.fastly.net NS ns4.fastly.net OPT"
"187","3.022068016","10.0.0.6","199.232.169.140","TCP","74","0x002","64240","0x00","","37588  >  443 [SYN] Seq=0 Win=64240 Len=0 MSS=1460 SACK_PERM TSval=1381408529 TSecr=0 WS=128"
"188","3.022391686","10.0.0.6","199.232.169.140","TCP","74","0x002","64240","0x00","","37592  >  443 [SYN] Seq=0 Win=64240 Len=0 MSS=1460 SACK_PERM TSval=1381408529 TSecr=0 WS=128"
"189","3.022612018","10.0.0.6","199.232.169.140","TCP","74","0x002","64240","0x00","","37604  >  443 [SYN] Seq=0 Win=64240 Len=0 MSS=1460 SACK_PERM TSval=1381408530 TSecr=0 WS=128"
"190","3.022785561","10.0.0.6","199.232.169.140","TCP","74","0x002","64240","0x00","","37616  >  443 [SYN] Seq=0 Win=64240 Len=0 MSS=1460 SACK_PERM TSval=1381408530 TSecr=0 WS=128"
"191","3.022936339","10.0.0.6","199.232.169.140","TCP","74","0x002","64240","0x00","","37618  >  443 [SYN] Seq=0 Win=64240 Len=0 MSS=1460 SACK_PERM TSval=1381408530 TSecr=0 WS=128"
"192","3.024435672","10.0.0.6","199.232.169.140","TCP","74","0x002","64240","0x00","","37628  >  443 [SYN] Seq=0 Win=64240 Len=0 MSS=1460 SACK_PERM TSval=1381408531 TSecr=0 WS=128"
"193","3.025424464","10.0.0.6","199.232.169.140","TCP","74","0x002","64240","0x00","","37636  >  443 [SYN] Seq=0 Win=64240 Len=0 MSS=1460 SACK_PERM TSval=1381408532 TSecr=0 WS=128"
"194","3.025624865","10.0.0.6","199.232.169.140","TCP","74","0x002","64240","0x00","","37646  >  443 [SYN] Seq=0 Win=64240 Len=0 MSS=1460 SACK_PERM TSval=1381408533 TSecr=0 WS=128"
"195","3.025733364","10.0.0.6","199.232.169.140","TCP","74","0x002","64240","0x00","","37650  >  443 [SYN] Seq=0 Win=64240 Len=0 MSS=1460 SACK_PERM TSval=1381408533 TSecr=0 WS=128"
"196","3.025835018","10.0.0.6","199.232.169.140","TCP","74","0x002","64240","0x00","","37660  >  443 [SYN] Seq=0 Win=64240 Len=0 MSS=1460 SACK_PERM TSval=1381408533 TSecr=0 WS=128"
"197","3.026582710","10.0.0.6","199.232.169.140","TCP","74","0x002","64240","0x00","","37664  >  443 [SYN] Seq=0 Win=64240 Len=0 MSS=1460 SACK_PERM TSval=1381408534 TSecr=0 WS=128"
"198","3.026757845","10.0.0.6","199.232.169.140","TCP","74","0x002","64240","0x00","","37668  >  443 [SYN] Seq=0 Win=64240 Len=0 MSS=1460 SACK_PERM TSval=1381408534 TSecr=0 WS=128"
"199","3.049533158","10.0.0.6","199.232.169.140","TCP","66","0x010","1122","0x00","","37584  >  443 [ACK] Seq=2539 Ack=77169 Win=143616 Len=0 TSval=1381408557 TSecr=980207118"
"200","3.071894213","HeightsTelec_bb:60:dc","Broadcast","ARP","60","","","","","Who has 10.0.0.1? Tell 10.0.0.138"
"201","3.088177534","199.232.169.140","10.0.0.6","TCP","74","0x012","65535","0x28","","443  >  37618 [SYN, ACK] Seq=0 Ack=1 Win=65535 Len=0 MSS=1452 SACK_PERM TSval=2562470739 TSecr=1381408530 WS=512"
"202","3.088228247","10.0.0.6","199.232.169.140","TCP","66","0x010","502","0x00","","37618  >  443 [ACK] Seq=1 Ack=1 Win=64256 Len=0 TSval=1381408595 TSecr=2562470739"
"203","3.088897108","10.0.0.6","199.232.169.140","TLSv1.3","1971","0x018","502","0x00","TLS 1.0","Client Hello (SNI=www.redditstatic.com)"
"204","3.090718354","199.232.169.140","10.0.0.6","TCP","74","0x012","65535","0x28","","443  >  37616 [SYN, ACK] Seq=0 Ack=1 Win=65535 Len=0 MSS=1452 SACK_PERM TSval=3977346745 TSecr=1381408530 WS=512"
"205","3.090791245","10.0.0.6","199.232.169.140","TCP","66","0x010","502","0x00","","37616  >  443 [ACK] Seq=1 Ack=1 Win=64256 Len=0 TSval=1381408598 TSecr=3977346745"
"206","3.091765083","10.0.0.6","199.232.169.140","TLSv1.3","1971","0x018","502","0x00","TLS 1.0","Client Hello (SNI=www.redditstatic.com)"
"207","3.091996102","199.232.169.140","10.0.0.6","TCP","74","0x012","65535","0x28","","443  >  37588 [SYN, ACK] Seq=0 Ack=1 Win=65535 Len=0 MSS=1452 SACK_PERM TSval=1827795581 TSecr=1381408529 WS=512"
"208","3.092019571","10.0.0.6","199.232.169.140","TCP","66","0x010","502","0x00","","37588  >  443 [ACK] Seq=1 Ack=1 Win=64256 Len=0 TSval=1381408599 TSecr=1827795581"
"209","3.093937887","10.0.0.6","199.232.169.140","TLSv1.3","1971","0x018","502","0x00","TLS 1.0","Client Hello (SNI=www.redditstatic.com)"
"210","3.094497441","199.232.169.140","10.0.0.6","TCP","74","0x012","65535","0x28","","443  >  37604 [SYN, ACK] Seq=0 Ack=1 Win=65535 Len=0 MSS=1452 SACK_PERM TSval=2576402816 TSecr=1381408530 WS=512"
"211","3.094497670","199.232.169.140","10.0.0.6","TCP","74","0x012","65535","0x28","","443  >  37668 [SYN, ACK] Seq=0 Ack=1 Win=65535 Len=0 MSS=1452 SACK_PERM TSval=3842755627 TSecr=1381408534 WS=512"
"212","3.094521490","10.0.0.6","199.232.169.140","TCP","66","0x010","502","0x00","","37604  >  443 [ACK] Seq=1 Ack=1 Win=64256 Len=0 TSval=1381408602 TSecr=2576402816"
"213","3.094604109","10.0.0.6","199.232.169.140","TCP","66","0x010","502","0x00","","37668  >  443 [ACK] Seq=1 Ack=1 Win=64256 Len=0 TSval=1381408602 TSecr=3842755627"
"214","3.095374008","10.0.0.6","199.232.169.140","TLSv1.3","1971","0x018","502","0x00","TLS 1.0","Client Hello (SNI=www.redditstatic.com)"
"215","3.096409260","10.0.0.6","199.232.169.140","TLSv1.3","1971","0x018","502","0x00","TLS 1.0","Client Hello (SNI=www.redditstatic.com)"
"216","3.103212970","199.232.169.140","10.0.0.6","TCP","74","0x012","65535","0x28","","443  >  37636 [SYN, ACK] Seq=0 Ack=1 Win=65535 Len=0 MSS=1452 SACK_PERM TSval=2086399780 TSecr=1381408532 WS=512"
"217","3.103213298","199.232.169.140","10.0.0.6","TCP","74","0x012","65535","0x28","","443  >  37646 [SYN, ACK] Seq=0 Ack=1 Win=65535 Len=0 MSS=1452 SACK_PERM TSval=2552559821 TSecr=1381408533 WS=512"
"218","3.103213323","199.232.169.140","10.0.0.6","TCP","74","0x012","65535","0x28","","443  >  37592 [SYN, ACK] Seq=0 Ack=1 Win=65535 Len=0 MSS=1452 SACK_PERM TSval=1024498767 TSecr=1381408529 WS=512"
"219","3.103213349","199.232.169.140","10.0.0.6","TCP","74","0x012","65535","0x28","","443  >  37650 [SYN, ACK] Seq=0 Ack=1 Win=65535 Len=0 MSS=1452 SACK_PERM TSval=801761435 TSecr=1381408533 WS=512"
"220","3.103213375","199.232.169.140","10.0.0.6","TCP","74","0x012","65535","0x28","","443  >  37660 [SYN, ACK] Seq=0 Ack=1 Win=65535 Len=0 MSS=1452 SACK_PERM TSval=3141988892 TSecr=1381408533 WS=512"
"221","3.103291540","10.0.0.6","199.232.169.140","TCP","66","0x010","502","0x00","","37636  >  443 [ACK] Seq=1 Ack=1 Win=64256 Len=0 TSval=1381408610 TSecr=2086399780"
"222","3.103458576","10.0.0.6","199.232.169.140","TCP","66","0x010","502","0x00","","37646  >  443 [ACK] Seq=1 Ack=1 Win=64256 Len=0 TSval=1381408611 TSecr=2552559821"
"223","3.103493856","10.0.0.6","199.232.169.140","TCP","66","0x010","502","0x00","","37592  >  443 [ACK] Seq=1 Ack=1 Win=64256 Len=0 TSval=1381408611 TSecr=1024498767"
"224","3.103523672","10.0.0.6","199.232.169.140","TCP","66","0x010","502","0x00","","37650  >  443 [ACK] Seq=1 Ack=1 Win=64256 Len=0 TSval=1381408611 TSecr=801761435"
"225","3.103551725","10.0.0.6","199.232.169.140","TCP","66","0x010","502","0x00","","37660  >  443 [ACK] Seq=1 Ack=1 Win=64256 Len=0 TSval=1381408611 TSecr=3141988892"
"226","3.104604976","199.232.169.140","10.0.0.6","TCP","74","0x012","65535","0x28","","443  >  37664 [SYN, ACK] Seq=0 Ack=1 Win=65535 Len=0 MSS=1452 SACK_PERM TSval=1708219429 TSecr=1381408534 WS=512"
"227","3.104605682","199.232.169.140","10.0.0.6","TCP","74","0x012","65535","0x28","","443  >  37628 [SYN, ACK] Seq=0 Ack=1 Win=65535 Len=0 MSS=1452 SACK_PERM TSval=411096716 TSecr=1381408531 WS=512"
"228","3.104626342","10.0.0.6","199.232.169.140","TCP","66","0x010","502","0x00","","37664  >  443 [ACK] Seq=1 Ack=1 Win=64256 Len=0 TSval=1381408612 TSecr=1708219429"
"229","3.104715936","10.0.0.6","199.232.169.140","TCP","66","0x010","502","0x00","","37628  >  443 [ACK] Seq=1 Ack=1 Win=64256 Len=0 TSval=1381408612 TSecr=411096716"
"230","3.104949537","10.0.0.6","199.232.169.140","TLSv1.3","1971","0x018","502","0x00","TLS 1.0","Client Hello (SNI=www.redditstatic.com)"
"231","3.105794639","10.0.0.6","199.232.169.140","TLSv1.3","1971","0x018","502","0x00","TLS 1.0","Client Hello (SNI=www.redditstatic.com)"
"232","3.106413745","10.0.0.6","199.232.169.140","TLSv1.3","1971","0x018","502","0x00","TLS 1.0","Client Hello (SNI=www.redditstatic.com)"
"233","3.107078612","10.0.0.6","199.232.169.140","TLSv1.3","1971","0x018","502","0x00","TLS 1.0","Client Hello (SNI=www.redditstatic.com)"
"234","3.107654106","10.0.0.6","199.232.169.140","TLSv1.3","1971","0x018","502","0x00","TLS 1.0","Client Hello (SNI=www.redditstatic.com)"
"235","3.108296244","10.0.0.6","199.232.169.140","TLSv1.3","1971","0x018","502","0x00","TLS 1.0","Client Hello (SNI=www.redditstatic.com)"
"236","3.108899575","10.0.0.6","199.232.169.140","TLSv1.3","1971","0x018","502","0x00","TLS 1.0","Client Hello (SNI=www.redditstatic.com)"
"237","3.154021651","199.232.169.140","10.0.0.6","TCP","66","0x010","291","0x28","","443  >  37618 [ACK] Seq=1 Ack=1906 Win=148992 Len=0 TSval=2562470805 TSecr=1381408596"
"238","3.158152858","199.232.169.140","10.0.0.6","TLSv1.3","2864","0x018","291","0x28","TLS 1.2,TLS 1.2,TLS 1.2","Server Hello, Change Cipher Spec, Application Data"
"239","3.158153229","199.232.169.140","10.0.0.6","TLSv1.3","1517","0x018","291","0x28","TLS 1.2,TLS 1.2,TLS 1.2,TLS 1.2","Application Data, Application Data, Application Data, Application Data"
"240","3.158230615","10.0.0.6","199.232.169.140","TCP","66","0x010","545","0x00","","37618  >  443 [ACK] Seq=1906 Ack=2799 Win=69760 Len=0 TSval=1381408665 TSecr=2562470807"
"241","3.158481703","10.0.0.6","199.232.169.140","TCP","66","0x010","568","0x00","","37618  >  443 [ACK] Seq=1906 Ack=4250 Win=72704 Len=0 TSval=1381408665 TSecr=2562470807"
"242","3.161547854","199.232.169.140","10.0.0.6","TCP","66","0x010","289","0x28","","443  >  37616 [ACK] Seq=1 Ack=1441 Win=147968 Len=0 TSval=3977346815 TSecr=1381408599"
"243","3.161548014","199.232.169.140","10.0.0.6","TCP","66","0x010","295","0x28","","443  >  37616 [ACK] Seq=1 Ack=1906 Win=151040 Len=0 TSval=3977346816 TSecr=1381408599"
"244","3.163694503","199.232.169.140","10.0.0.6","TLSv1.3","2864","0x018","295","0x28","TLS 1.2,TLS 1.2,TLS 1.2","Server Hello, Change Cipher Spec, Application Data"
"245","3.163749731","10.0.0.6","199.232.169.140","TCP","66","0x010","545","0x00","","37616  >  443 [ACK] Seq=1906 Ack=2799 Win=69760 Len=0 TSval=1381408671 TSecr=3977346817"
"246","3.164333615","199.232.169.140","10.0.0.6","TLSv1.3","1517","0x018","295","0x28","TLS 1.2,TLS 1.2,TLS 1.2,TLS 1.2","Application Data, Application Data, Application Data, Application Data"
"247","3.164349717","10.0.0.6","199.232.169.140","TCP","66","0x010","568","0x00","","37616  >  443 [ACK] Seq=1906 Ack=4250 Win=72704 Len=0 TSval=1381408671 TSecr=3977346817"
"248","3.165329648","10.0.0.6","199.232.169.140","TLSv1.3","130","0x018","568","0x00","TLS 1.2,TLS 1.2","Change Cipher Spec, Application Data"
"249","3.166020967","10.0.0.6","199.232.169.140","TLSv1.3","130","0x018","568","0x00","TLS 1.2,TLS 1.2","Change Cipher Spec, Application Data"
"250","3.167583462","10.0.0.6","199.232.169.140","TLSv1.3","158","0x018","568","0x00","TLS 1.2","Application Data"
"251","3.167746442","10.0.0.6","199.232.169.140","TLSv1.3","374","0x018","568","0x00","TLS 1.2","Application Data"
"252","3.168197918","199.232.169.140","10.0.0.6","TCP","66","0x010","291","0x28","","443  >  37668 [ACK] Seq=1 Ack=1906 Win=148992 Len=0 TSval=3842755700 TSecr=1381408602"
"253","3.168255981","10.0.0.6","199.232.169.140","TLSv1.3","180","0x018","568","0x00","TLS 1.2","Application Data"
"254","3.168491670","10.0.0.6","199.232.169.140","TLSv1.3","168","0x018","568","0x00","TLS 1.2","Application Data"
"255","3.168670014","10.0.0.6","199.232.169.140","TLSv1.3","184","0x018","568","0x00","TLS 1.2","Application Data"
"256","3.168961920","10.0.0.6","199.232.169.140","TLSv1.3","183","0x018","568","0x00","TLS 1.2","Application Data"
"257","3.169139682","10.0.0.6","199.232.169.140","TLSv1.3","171","0x018","568","0x00","TLS 1.2","Application Data"
"258","3.169268766","10.0.0.6","199.232.169.140","TLSv1.3","178","0x018","568","0x00","TLS 1.2","Application Data"
