"No.","Time","Source","Destination","Protocol","Length","Flags","Window","Differentiated Services Field","Version","Info"
"1","0.000000000","10.0.0.6","141.226.228.48","TLSv1.2","210","0x018","575","0x00","TLS 1.2","Application Data"
"2","0.000300546","10.0.0.6","141.226.228.48","TLSv1.2","1326","0x018","575","0x00","TLS 1.2","Application Data"
"3","0.005945748","35.167.59.240","10.0.0.6","TLSv1.2","112","0x018","245","0x00","TLS 1.2","Application Data"
"4","0.005945989","35.167.59.240","10.0.0.6","TLSv1.2","97","0x018","245","0x00","TLS 1.2","Encrypted Alert"
"5","0.005946025","35.167.59.240","10.0.0.6","TCP","66","0x011","245","0x00","","443  >  49476 [FIN, ACK] Seq=78 Ack=1 Win=245 Len=0 TSval=4030338683 TSecr=3968503380"
"6","0.005978884","10.0.0.6","35.167.59.240","TCP","66","0x010","630","0x00","","49476  >  443 [ACK] Seq=1 Ack=47 Win=630 Len=0 TSval=3968563576 TSecr=4030338683"
"7","0.006144217","10.0.0.6","35.167.59.240","TCP","66","0x014","630","0x00","","49476  >  443 [RST, ACK] Seq=1 Ack=79 Win=630 Len=0 TSval=3968563576 TSecr=4030338683"
"8","0.130232925","10.0.0.6","80.77.87.162","TCP","74","0x002","64240","0x00","","55750  >  443 [SYN] Seq=0 Win=64240 Len=0 MSS=1460 SACK_PERM TSval=1414936307 TSecr=0 WS=128"
"9","0.140436341","141.226.228.48","10.0.0.6","TLSv1.2","96","0x018","161","0x48","TLS 1.2","Application Data"
"10","0.140436704","141.226.228.48","10.0.0.6","TLSv1.2","636","0x018","167","0x48","TLS 1.2","Application Data"
"11","0.140504134","10.0.0.6","141.226.228.48","TCP","54","0x010","575","0x00","","40254  >  443 [ACK] Seq=1429 Ack=43 Win=575 Len=0"
"12","0.140658346","10.0.0.6","141.226.228.48","TCP","54","0x010","571","0x00","","40254  >  443 [ACK] Seq=1429 Ack=625 Win=571 Len=0"
"13","0.149865172","HeightsTelec_bb:60:dc","Broadcast","ARP","60","","","","","Who has 10.0.0.18? Tell 10.0.0.138"
"14","0.251846038","HeightsTelec_bb:60:dc","Broadcast","ARP","60","","","","","Who has 10.0.0.28? Tell 10.0.0.138"
"15","0.881467935","69.173.156.139","10.0.0.6","TLSv1.2","105","0x018","51148","0x00","TLS 1.2","Application Data"
"16","0.882198101","10.0.0.6","69.173.156.139","TCP","66","0x011","501","0x00","","57202  >  443 [FIN, ACK] Seq=1 Ack=40 Win=501 Len=0 TSval=1398020196 TSecr=2757366565"
"17","0.971903180","69.173.156.139","10.0.0.6","TCP","66","0x011","51148","0x00","","443  >  57202 [FIN, ACK] Seq=40 Ack=2 Win=51148 Len=0 TSval=2757366602 TSecr=1398020196"
"18","0.971929992","10.0.0.6","69.173.156.139","TCP","66","0x010","501","0x00","","57202  >  443 [ACK] Seq=2 Ack=41 Win=501 Len=0 TSval=1398020286 TSecr=2757366602"
"19","1.071295227","HeightsTelec_bb:60:dc","Broadcast","ARP","60","","","","","Who has 10.0.0.1? Tell 10.0.0.138"
"20","1.174619067","HeightsTelec_bb:60:dc","Broadcast","ARP","60","","","","","Who has 10.0.0.13? Tell 10.0.0.138"
"21","1.379446732","HeightsTelec_bb:60:dc","Broadcast","ARP","60","","","","","Who has 10.0.0.19? Tell 10.0.0.138"
"22","1.481978070","HeightsTelec_bb:60:dc","Broadcast","ARP","60","","","","","Who has 10.0.0.13? Tell 10.0.0.138"
"23","1.584509654","HeightsTelec_bb:60:dc","Broadcast","ARP","60","","","","","Who has 10.0.0.28? Tell 10.0.0.138"
"24","1.688725699","18.138.29.221","10.0.0.6","TLSv1.2","112","0x018","128","0x00","TLS 1.2","Application Data"
"25","1.688726941","18.138.29.221","10.0.0.6","TLSv1.2","97","0x018","128","0x00","TLS 1.2","Encrypted Alert"
"26","1.688726968","18.138.29.221","10.0.0.6","TCP","66","0x011","128","0x00","","443  >  60524 [FIN, ACK] Seq=78 Ack=1 Win=128 Len=0 TSval=1724605360 TSecr=1151510578"
"27","1.729449483","10.0.0.6","18.138.29.221","TCP","66","0x010","591","0x00","","60524  >  443 [ACK] Seq=1 Ack=79 Win=591 Len=0 TSval=1151570729 TSecr=1724605360"
"28","1.738793389","18.138.29.221","10.0.0.6","TLSv1.2","112","0x018","189","0x00","TLS 1.2","Application Data"
"29","1.738793941","18.138.29.221","10.0.0.6","TLSv1.2","97","0x018","189","0x00","TLS 1.2","Encrypted Alert"
"30","1.738794011","18.138.29.221","10.0.0.6","TCP","66","0x011","189","0x00","","443  >  60512 [FIN, ACK] Seq=78 Ack=1 Win=189 Len=0 TSval=1724605512 TSecr=1151510343"
"31","1.739102820","10.0.0.6","18.138.29.221","TCP","66","0x010","613","0x00","","60512  >  443 [ACK] Seq=1 Ack=79 Win=613 Len=0 TSval=1151570738 TSecr=1724605512"
"32","1.739660097","10.0.0.6","18.138.29.221","TCP","66","0x011","613","0x00","","60512  >  443 [FIN, ACK] Seq=1 Ack=79 Win=613 Len=0 TSval=1151570739 TSecr=1724605512"
"33","1.788457869","HeightsTelec_bb:60:dc","Broadcast","ARP","60","","","","","Who has 169.254.170.91? Tell 10.0.0.138"
"34","1.841236264","10.0.0.6","98.137.11.163","TCP","66","0x010","627","0x00","","56160  >  443 [ACK] Seq=1 Ack=1 Win=627 Len=0 TSval=196094621 TSecr=2920831225"
"35","1.890856456","HeightsTelec_bb:60:dc","Broadcast","ARP","60","","","","","Who has 10.0.0.6? Tell 10.0.0.138"
"36","1.890882654","VMware_fb:1e:36","HeightsTelec_bb:60:dc","ARP","42","","","","","10.0.0.6 is at 00:0c:29:fb:1e:36"
"37","1.993899334","HeightsTelec_bb:60:dc","Broadcast","ARP","60","","","","","Who has 10.0.0.2? Tell 10.0.0.138"
"38","2.003899182","10.0.0.138","10.0.0.6","NBNS","92","","","0x00","","Name query NBSTAT *<00><00><00><00><00><00><00><00><00><00><00><00><00><00><00>"
"39","2.003953560","10.0.0.6","10.0.0.138","ICMP","120","","","0xc0,0x00","","Destination unreachable (Port unreachable)"
"40","2.100578375","98.137.11.163","10.0.0.6","TCP","66","0x010","294","0x00","","[TCP ACKed unseen segment] 443  >  56160 [ACK] Seq=1 Ack=2 Win=294 Len=0 TSval=2920876461 TSecr=196003018"
"41","2.118838661","10.0.0.6","87.248.116.12","TLSv1.2","1290","0x018","18939","0x00","TLS 1.2","Application Data"
"42","2.119122219","10.0.0.6","10.0.0.138","DNS","91","","","0x00","","Standard query 0xdafd A bats.video.yahoo.com OPT"
"43","2.119125922","10.0.0.6","10.0.0.138","DNS","91","","","0x00","","Standard query 0xf4cf HTTPS bats.video.yahoo.com OPT"
"44","2.119326152","10.0.0.6","87.248.116.12","TLSv1.2","105","0x018","18939","0x00","TLS 1.2","Application Data"
"45","2.123659095","18.138.29.221","10.0.0.6","TCP","66","0x010","189","0x00","","443  >  60512 [ACK] Seq=79 Ack=2 Win=189 Len=0 TSval=1724605906 TSecr=1151570739"
"46","2.127705686","10.0.0.6","10.0.0.138","DNS","106","","","0x00","","Standard query 0x368a HTTPS optimizationguide-pa.googleapis.com OPT"
"47","2.133010857","10.0.0.6","10.0.0.138","DNS","86","","","0x00","","Standard query 0x9797 A www.youtube.com OPT"
"48","2.133418880","10.0.0.6","10.0.0.138","DNS","86","","","0x00","","Standard query 0xae0b HTTPS www.youtube.com OPT"
"49","2.136876450","10.0.0.6","142.250.75.74","QUIC","1292","","","0x00","","Initial, DCID=eb0c6237ae7da0eb, PKN: 1, CRYPTO"
"50","2.137115942","10.0.0.6","142.250.75.74","QUIC","1292","","","0x00","","Initial, DCID=eb0c6237ae7da0eb, PKN: 2, PADDING, CRYPTO, CRYPTO, CRYPTO, CRYPTO, CRYPTO, CRYPTO, PADDING"
"51","2.137957448","10.0.0.6","142.250.75.74","QUIC","123","","","0x00","","0-RTT, DCID=eb0c6237ae7da0eb"
"52","2.138850536","10.0.0.6","188.125.72.139","TLSv1.2","1154","0x018","690","0x00","TLS 1.2","Application Data"
"53","2.140006404","10.0.0.6","188.125.72.139","TLSv1.2","105","0x018","690","0x00","TLS 1.2","Application Data"
"54","2.140165129","10.0.0.6","188.125.72.139","TLSv1.2","1185","0x018","690","0x00","TLS 1.2","Application Data"
"55","2.144909751","142.250.75.74","10.0.0.6","QUIC","82","","","0x80","","Initial, SCID=eb0c6237ae7da0eb, PKN: 1, ACK"
"56","2.146286773","142.250.75.74","10.0.0.6","QUIC","1292","","","0x80","","Initial, SCID=eb0c6237ae7da0eb, PKN: 2, ACK, PADDING"
"57","2.146939666","10.0.0.138","10.0.0.6","DNS","162","","","0x00","","Standard query response 0xdafd A bats.video.yahoo.com CNAME edge.gycpi.b.yahoodns.net A 87.248.116.12 A 87.248.116.11 OPT"
"58","2.150495564","10.0.0.6","188.125.72.139","TLSv1.2","522","0x018","690","0x00","TLS 1.2","Application Data"
"59","2.151042401","10.0.0.138","10.0.0.6","DNS","202","","","0x00","","Standard query response 0xf4cf HTTPS bats.video.yahoo.com CNAME edge.gycpi.b.yahoodns.net SOA yf1.a1.b.yahoo.net OPT"
"60","2.151042814","10.0.0.138","10.0.0.6","DNS","163","","","0x00","","Standard query response 0x368a HTTPS optimizationguide-pa.googleapis.com SOA ns1.google.com OPT"
"61","2.151042887","10.0.0.138","10.0.0.6","DNS","200","","","0x00","","Standard query response 0x9797 A www.youtube.com CNAME youtube-ui.l.google.com A 142.250.75.142 A 142.250.75.174 A 142.250.75.46 A 142.250.75.78 A 142.250.75.110 OPT"
"62","2.151141995","10.0.0.6","188.125.72.139","TLSv1.2","521","0x018","690","0x00","TLS 1.2","Application Data"
"63","2.151313226","10.0.0.6","10.0.0.138","DNS","96","","","0x00","","Standard query 0x147f HTTPS edge.gycpi.b.yahoodns.net OPT"
"64","2.152539041","10.0.0.138","10.0.0.6","DNS","135","","","0x00","","Standard query response 0xae0b HTTPS www.youtube.com CNAME youtube-ui.l.google.com HTTPS OPT"
"65","2.154862092","10.0.0.6","172.64.150.63","TCP","66","0x011","575","0x00","","42414  >  443 [FIN, ACK] Seq=1 Ack=1 Win=575 Len=0 TSval=391147601 TSecr=2120940145"
"66","2.155119190","10.0.0.6","67.220.226.238","TCP","54","0x014","626","0x00","","33790  >  443 [RST, ACK] Seq=1 Ack=1 Win=626 Len=0"
"67","2.155302548","10.0.0.6","52.221.18.0","TCP","66","0x011","590","0x00","","51900  >  443 [FIN, ACK] Seq=1 Ack=1 Win=590 Len=0 TSval=2896273956 TSecr=2643372353"
"68","2.155474718","10.0.0.6","18.138.29.221","TCP","66","0x014","591","0x00","","60524  >  443 [RST, ACK] Seq=1 Ack=79 Win=591 Len=0 TSval=1151571155 TSecr=1724605360"
"69","2.155577189","10.0.0.6","104.16.183.87","TCP","66","0x011","583","0x00","","51976  >  443 [FIN, ACK] Seq=1 Ack=1 Win=583 Len=0 TSval=2555837383 TSecr=1733204375"
"70","2.155674097","10.0.0.6","142.250.75.131","TCP","66","0x011","610","0x00","","48880  >  443 [FIN, ACK] Seq=1 Ack=1 Win=610 Len=0 TSval=73959240 TSecr=1161229395"
"71","2.155770909","10.0.0.6","142.250.75.131","TCP","66","0x011","610","0x00","","48886  >  443 [FIN, ACK] Seq=1 Ack=1 Win=610 Len=0 TSval=73959240 TSecr=3605764520"
"72","2.155846400","10.0.0.6","142.250.75.131","TCP","66","0x011","610","0x00","","48894  >  443 [FIN, ACK] Seq=1 Ack=1 Win=610 Len=0 TSval=73959240 TSecr=922431539"
"73","2.155931319","10.0.0.6","207.65.33.82","TCP","66","0x011","572","0x00","","54276  >  443 [FIN, ACK] Seq=1 Ack=1 Win=572 Len=0 TSval=2089595262 TSecr=1725539037"
"74","2.156005521","10.0.0.6","207.65.33.82","TCP","66","0x011","538","0x00","","54284  >  443 [FIN, ACK] Seq=1 Ack=1 Win=538 Len=0 TSval=2089595262 TSecr=1725539024"
"75","2.156083869","10.0.0.6","67.199.150.82","TCP","66","0x011","538","0x00","","60258  >  443 [FIN, ACK] Seq=1 Ack=1 Win=538 Len=0 TSval=2850103987 TSecr=1725494863"
"76","2.156174907","10.0.0.6","34.252.81.5","TCP","66","0x014","535","0x00","","33470  >  443 [RST, ACK] Seq=1 Ack=1 Win=535 Len=0 TSval=2082423657 TSecr=3858020293"
"77","2.158338197","10.0.0.6","98.82.158.241","TCP","66","0x014","495","0x00","","47110  >  443 [RST, ACK] Seq=1 Ack=1 Win=495 Len=0 TSval=2936260004 TSecr=2755324498"
"78","2.158486538","10.0.0.6","104.18.26.193","TCP","66","0x011","577","0x00","","35074  >  443 [FIN, ACK] Seq=1 Ack=1 Win=577 Len=0 TSval=751784310 TSecr=3808099249"
"79","2.158561263","10.0.0.6","104.18.26.193","TCP","66","0x011","571","0x00","","35076  >  443 [FIN, ACK] Seq=1 Ack=1 Win=571 Len=0 TSval=751784310 TSecr=3371332832"
"80","2.158626948","10.0.0.6","45.137.176.88","TCP","66","0x014","589","0x00","","41470  >  443 [RST, ACK] Seq=1 Ack=1 Win=589 Len=0 TSval=81420485 TSecr=1012111431"
"81","2.158689501","10.0.0.6","45.137.176.88","TCP","66","0x014","610","0x00","","41484  >  443 [RST, ACK] Seq=1 Ack=1 Win=610 Len=0 TSval=81420485 TSecr=1987698169"
"82","2.158882103","10.0.0.6","142.250.75.142","TCP","74","0x002","64240","0x00","","58082  >  443 [SYN] Seq=0 Win=64240 Len=0 MSS=1460 SACK_PERM TSval=3508698921 TSecr=0 WS=128"
"83","2.159051727","10.0.0.6","142.250.75.74","QUIC","1292","","","0x00","","Initial, DCID=eb0c6237ae7da0eb, PKN: 5, PADDING, PING, PADDING"
"84","2.162166253","172.64.150.63","10.0.0.6","TCP","66","0x011","9","0x88","","443  >  42414 [FIN, ACK] Seq=1 Ack=2 Win=9 Len=0 TSval=2120957018 TSecr=391147601"
"85","2.162308321","10.0.0.6","172.64.150.63","TCP","66","0x010","575","0x00","","42414  >  443 [ACK] Seq=2 Ack=2 Win=575 Len=0 TSval=391147609 TSecr=2120957018"
"86","2.162636872","10.0.0.138","10.0.0.6","DNS","171","","","0x00","","Standard query response 0x147f HTTPS edge.gycpi.b.yahoodns.net SOA yf1.a1.b.yahoo.net OPT"
"87","2.162636989","142.250.75.131","10.0.0.6","TCP","66","0x011","1043","0x80","","443  >  48894 [FIN, ACK] Seq=1 Ack=2 Win=1043 Len=0 TSval=922456605 TSecr=73959240"
"88","2.162637025","142.250.75.131","10.0.0.6","TCP","66","0x011","1044","0x80","","443  >  48880 [FIN, ACK] Seq=1 Ack=2 Win=1044 Len=0 TSval=1161254461 TSecr=73959240"
"89","2.162637051","142.250.75.131","10.0.0.6","TCP","66","0x011","1043","0x80","","443  >  48886 [FIN, ACK] Seq=1 Ack=2 Win=1043 Len=0 TSval=3605789587 TSecr=73959240"
"90","2.162663331","10.0.0.6","142.250.75.131","TCP","66","0x010","610","0x00","","48894  >  443 [ACK] Seq=2 Ack=2 Win=610 Len=0 TSval=73959247 TSecr=922456605"
"91","2.162710146","10.0.0.6","142.250.75.131","TCP","66","0x010","610","0x00","","48880  >  443 [ACK] Seq=2 Ack=2 Win=610 Len=0 TSval=73959247 TSecr=1161254461"
"92","2.162739558","10.0.0.6","142.250.75.131","TCP","66","0x010","610","0x00","","48886  >  443 [ACK] Seq=2 Ack=2 Win=610 Len=0 TSval=73959247 TSecr=3605789587"
"93","2.169151325","10.0.0.6","104.18.27.193","UDP","1286","","","0x00","","57159  >  443 Len=1244"
"94","2.170594631","10.0.0.6","104.18.27.193","UDP","1292","","","0x00","","57159  >  443 Len=1250"
"95","2.170755832","10.0.0.6","104.18.27.193","UDP","849","","","0x00","","57159  >  443 Len=807"
"96","2.171077041","10.0.0.6","87.248.116.12","TLSv1.2","2430","0x018","18939","0x00","TLS 1.2","Application Data"
"97","2.171374035","142.250.75.142","10.0.0.6","TCP","74","0x012","65535","0x80","","443  >  58082 [SYN, ACK] Seq=0 Ack=1 Win=65535 Len=0 MSS=1412 SACK_PERM TSval=2102857764 TSecr=3508698921 WS=256"
"98","2.171374226","142.250.75.74","10.0.0.6","QUIC","1292","","","0x80","","Initial, SCID=eb0c6237ae7da0eb, PKN: 3, ACK, PADDING"
"99","2.171428169","10.0.0.6","142.250.75.142","TCP","66","0x010","502","0x00","","58082  >  443 [ACK] Seq=1 Ack=1 Win=64256 Len=0 TSval=3508698934 TSecr=2102857764"
"100","2.172699149","10.0.0.6","87.248.116.12","TCP","2946","0x018","18939","0x00","","42042  >  443 [PSH, ACK] Seq=3628 Ack=1 Win=18939 Len=2880 TSval=2340454333 TSecr=3398533088 [TCP PDU reassembled in 101]"
"101","2.172857830","10.0.0.6","87.248.116.12","TLSv1.2","1448","0x018","18939","0x00","TLS 1.2","Application Data"
"102","2.173187865","10.0.0.6","142.250.75.142","TLSv1.3","1823","0x018","502","0x00","TLS 1.0","Client Hello (SNI=www.youtube.com)"
"103","2.176546553","10.0.0.6","35.227.252.103","UDP","1288","","","0x00","","47848  >  443 Len=1246"
"104","2.177053741","10.0.0.6","35.227.252.103","UDP","1292","","","0x00","","47848  >  443 Len=1250"
"105","2.178382016","10.0.0.6","35.227.252.103","UDP","1032","","","0x00","","47848  >  443 Len=990"
"106","2.178630226","10.0.0.6","3.0.115.6","TLSv1.2","1427","0x018","690","0x00","TLS 1.2","Application Data"
"107","2.179169933","10.0.0.6","3.0.115.6","TLSv1.2","105","0x018","690","0x00","TLS 1.2","Application Data"
"108","2.179732598","142.250.75.142","10.0.0.6","TCP","66","0x010","1050","0x80","","443  >  58082 [ACK] Seq=1 Ack=1401 Win=268800 Len=0 TSval=2102857779 TSecr=3508698935"
"109","2.183359729","35.227.252.103","10.0.0.6","UDP","69","","","0x80","","443  >  47848 Len=27"
"110","2.183360074","142.250.75.142","10.0.0.6","TCP","66","0x010","1050","0x80","","443  >  58082 [ACK] Seq=1 Ack=1758 Win=268800 Len=0 TSval=2102857782 TSecr=3508698935"
"111","2.184516600","10.0.0.6","178.250.7.48","TCP","74","0x002","64240","0x00","","53938  >  443 [SYN] Seq=0 Win=64240 Len=0 MSS=1460 SACK_PERM TSval=720068898 TSecr=0 WS=128"
"112","2.186720142","10.0.0.6","3.78.168.176","TLSv1.2","649","0x018","646","0x00","TLS 1.2","Application Data"
"113","2.187585931","10.0.0.6","3.78.168.176","TLSv1.2","105","0x018","646","0x00","TLS 1.2","Application Data"
"114","2.187739252","10.0.0.6","3.78.168.176","TCP","2946","0x018","646","0x00","","33232  >  443 [PSH, ACK] Seq=623 Ack=1 Win=646 Len=2880 TSval=2132379349 TSecr=1976138600 [TCP PDU reassembled in 115]"
"115","2.187902748","10.0.0.6","3.78.168.176","TLSv1.2","2712","0x018","646","0x00","TLS 1.2","Application Data"
"116","2.189925218","10.0.0.6","34.120.63.153","UDP","1288","","","0x00","","54039  >  443 Len=1246"
"117","2.191370878","10.0.0.6","34.120.63.153","UDP","1292","","","0x00","","54039  >  443 Len=1250"
"118","2.191912918","10.0.0.6","34.120.63.153","UDP","1292","","","0x00","","54039  >  443 Len=1250"
"119","2.192023636","10.0.0.6","34.120.63.153","UDP","1233","","","0x00","","54039  >  443 Len=1191"
"120","2.192177135","10.0.0.6","142.250.75.74","QUIC","1292","","","0x00","","Initial, DCID=eb0c6237ae7da0eb, PKN: 7, PADDING, PING, PADDING"
"121","2.197443828","HeightsTelec_bb:60:dc","Broadcast","ARP","60","","","","","Who has 10.0.0.18? Tell 10.0.0.138"
"122","2.198845260","142.250.75.74","10.0.0.6","QUIC","1292","","","0x80","","Initial, SCID=eb0c6237ae7da0eb, PKN: 4, CRYPTO, PADDING"
"123","2.198845525","142.250.75.74","10.0.0.6","QUIC","352","","","0x80","","Protected Payload (KP0)"
"124","2.198845563","142.250.75.74","10.0.0.6","QUIC","982","","","0x80","","Protected Payload (KP0)"
"125","2.198845589","142.250.75.74","10.0.0.6","QUIC","109","","","0x80","","Protected Payload (KP0)"
"126","2.198845617","142.250.75.74","10.0.0.6","QUIC","66","","","0x80","","Protected Payload (KP0)"
"127","2.199552186","142.250.75.74","10.0.0.6","QUIC","1292","","","0x80","","Initial, SCID=eb0c6237ae7da0eb, PKN: 10, ACK, CRYPTO, PADDING"
"128","2.200134040","34.120.63.153","10.0.0.6","UDP","69","","","0x60","","443  >  54039 Len=27"
"129","2.200134090","34.120.63.153","10.0.0.6","UDP","65","","","0x60","","443  >  54039 Len=23"
"130","2.201787037","10.0.0.6","142.250.75.74","QUIC","120","","","0x00","","Handshake, DCID=eb0c6237ae7da0eb"
"131","2.202042827","10.0.0.6","142.250.75.74","QUIC","73","","","0x00","","Protected Payload (KP0), DCID=eb0c6237ae7da0eb"
"132","2.202555922","10.0.0.6","67.199.150.87","TLSv1.2","218","0x018","560","0x00","TLS 1.2","Application Data"
"133","2.203152685","87.248.116.12","10.0.0.6","TCP","66","0x010","23","0x00","","443  >  42042 [ACK] Seq=1 Ack=1264 Win=23 Len=0 TSval=3398549234 TSecr=2340454280"
"134","2.203581560","10.0.0.6","67.199.150.87","TLSv1.2","105","0x018","560","0x00","TLS 1.2","Application Data"
"135","2.203775289","10.0.0.6","67.199.150.87","TLSv1.2","2548","0x018","560","0x00","TLS 1.2","Application Data"
"136","2.204639642","10.0.0.6","142.250.75.74","QUIC","600","","","0x00","","Protected Payload (KP0), DCID=eb0c6237ae7da0eb"
"137","2.205666354","10.0.0.6","143.244.200.230","TCP","2842","0x018","685","0x00","","53072  >  443 [PSH, ACK] Seq=1 Ack=1 Win=685 Len=2776 TSval=1468380077 TSecr=702541219 [TCP PDU reassembled in 139]"
"138","2.205839732","10.0.0.6","143.244.200.230","TCP","2842","0x018","685","0x00","","53072  >  443 [PSH, ACK] Seq=2777 Ack=1 Win=685 Len=2776 TSval=1468380077 TSecr=702541219 [TCP PDU reassembled in 139]"
"139","2.205945267","10.0.0.6","143.244.200.230","TLSv1.2","2467","0x018","685","0x00","TLS 1.2","Application Data"
"140","2.206058475","10.0.0.6","143.244.200.230","TLSv1.2","105","0x018","685","0x00","TLS 1.2","Application Data"
"141","2.206183689","10.0.0.6","143.244.200.230","TCP","2842","0x018","685","0x00","","53072  >  443 [PSH, ACK] Seq=7993 Ack=1 Win=685 Len=2776 TSval=1468380077 TSecr=702541219 [TCP PDU reassembled in 271]"
"142","2.206277503","10.0.0.6","143.244.200.230","TCP","1454","0x010","685","0x00","","53072  >  443 [ACK] Seq=10769 Ack=1 Win=685 Len=1388 TSval=1468380077 TSecr=702541219 [TCP PDU reassembled in 271]"
"143","2.207147570","142.250.75.74","10.0.0.6","QUIC","162","","","0x80","","Protected Payload (KP0)"
"144","2.207281706","10.0.0.6","142.250.75.74","QUIC","76","","","0x00","","Protected Payload (KP0), DCID=eb0c6237ae7da0eb"
"145","2.209067209","87.248.116.12","10.0.0.6","TLSv1.2","105","0x018","23","0x00","TLS 1.2","Application Data"
"146","2.209081427","10.0.0.6","87.248.116.12","TCP","66","0x010","18939","0x00","","42042  >  443 [ACK] Seq=7890 Ack=40 Win=18939 Len=0 TSval=2340454369 TSecr=3398549236"
"147","2.209693678","35.227.252.103","10.0.0.6","UDP","66","","","0x60","","443  >  47848 Len=24"
"148","2.212357684","10.0.0.6","35.227.252.103","UDP","74","","","0x00","","47848  >  443 Len=32"
"149","2.213540953","142.250.75.74","10.0.0.6","QUIC","71","","","0x80","","Protected Payload (KP0)"
"150","2.214202679","10.0.0.6","199.232.81.44","TLSv1.2","156","0x018","777","0x00","TLS 1.2","Application Data"
"151","2.214700537","10.0.0.6","199.232.81.44","TLSv1.2","105","0x018","777","0x00","TLS 1.2","Application Data"
"152","2.214959710","10.0.0.6","199.232.81.44","TCP","2946","0x018","777","0x00","","57486  >  443 [PSH, ACK] Seq=130 Ack=1 Win=777 Len=2880 TSval=201384131 TSecr=1635618138 [TCP PDU reassembled in 155]"
"153","2.215234465","104.16.183.87","10.0.0.6","TCP","66","0x011","8","0x00","","443  >  51976 [FIN, ACK] Seq=1 Ack=2 Win=8 Len=0 TSval=1733233530 TSecr=2555837383"
"154","2.215256813","10.0.0.6","104.16.183.87","TCP","66","0x010","583","0x00","","51976  >  443 [ACK] Seq=2 Ack=2 Win=583 Len=0 TSval=2555837443 TSecr=1733233530"
"155","2.215534488","10.0.0.6","199.232.81.44","TLSv1.2","549","0x018","777","0x00","TLS 1.2","Application Data"
"156","2.219050271","10.0.0.6","142.250.75.74","QUIC","75","","","0x00","","Protected Payload (KP0), DCID=eb0c6237ae7da0eb"
"157","2.219718240","104.18.26.193","10.0.0.6","TCP","66","0x011","8","0x00","","443  >  35074 [FIN, ACK] Seq=1 Ack=2 Win=8 Len=0 TSval=3808120211 TSecr=751784310"
"158","2.219744296","10.0.0.6","104.18.26.193","TCP","66","0x010","577","0x00","","35074  >  443 [ACK] Seq=2 Ack=2 Win=577 Len=0 TSval=751784371 TSecr=3808120211"
"159","2.222579532","10.0.0.6","69.173.156.139","TCP","74","0x002","64240","0x00","","47936  >  443 [SYN] Seq=0 Win=64240 Len=0 MSS=1460 SACK_PERM TSval=1398021537 TSecr=0 WS=128"
"160","2.224595106","104.18.26.193","10.0.0.6","TCP","66","0x011","9","0x00","","443  >  35076 [FIN, ACK] Seq=1 Ack=2 Win=9 Len=0 TSval=3371353795 TSecr=751784310"
"161","2.224616370","10.0.0.6","104.18.26.193","TCP","66","0x010","571","0x00","","35076  >  443 [ACK] Seq=2 Ack=2 Win=571 Len=0 TSval=751784376 TSecr=3371353795"
"162","2.225137439","10.0.0.6","52.214.234.187","TLSv1.2","159","0x018","603","0x00","TLS 1.2","Application Data"
"163","2.225329680","10.0.0.6","52.214.234.187","TLSv1.2","205","0x018","603","0x00","TLS 1.2,TLS 1.2","Application Data, Application Data"
"164","2.225424213","10.0.0.6","52.214.234.187","TLSv1.2","2355","0x018","603","0x00","TLS 1.2","Application Data"
"165","2.225947506","10.0.0.6","52.214.234.187","TLSv1.2","2357","0x018","603","0x00","TLS 1.2","Application Data"
"166","2.226114031","10.0.0.6","34.149.50.64","UDP","1288","","","0x00","","37554  >  443 Len=1246"
"167","2.226116306","10.0.0.6","34.149.50.64","UDP","350","","","0x00","","37554  >  443 Len=308"
"168","2.228366805","10.0.0.6","34.120.63.153","UDP","74","","","0x00","","54039  >  443 Len=32"
"169","2.230377927","188.125.72.139","10.0.0.6","TCP","66","0x010","1430","0x00","","443  >  53246 [ACK] Seq=1 Ack=2247 Win=1430 Len=0 TSval=2730655681 TSecr=4055460507"
"170","2.231151985","104.18.27.193","10.0.0.6","UDP","66","","","0x00","","443  >  57159 Len=24"
"171","2.231707166","104.18.27.193","10.0.0.6","UDP","65","","","0x00","","443  >  57159 Len=23"
"172","2.232663481","188.125.72.139","10.0.0.6","TLSv1.2","105","0x018","1432","0x00","TLS 1.2","Application Data"
"173","2.232688158","10.0.0.6","188.125.72.139","TCP","66","0x010","690","0x00","","53246  >  443 [ACK] Seq=3158 Ack=40 Win=690 Len=0 TSval=4055460601 TSecr=2730655682"
"174","2.233577235","34.149.50.64","10.0.0.6","UDP","69","","","0x80","","443  >  37554 Len=27"
"175","2.237852271","142.250.75.142","10.0.0.6","TLSv1.3","1465","0x010","1050","0x80","TLS 1.2,TLS 1.2","Server Hello, Change Cipher Spec"
"176","2.237879057","10.0.0.6","142.250.75.142","TCP","66","0x010","524","0x00","","58082  >  443 [ACK] Seq=1758 Ack=1400 Win=67072 Len=0 TSval=3508699000 TSecr=2102857835"
"177","2.238902772","142.250.75.142","10.0.0.6","TCP","1465","0x018","1050","0x80","","443  >  58082 [PSH, ACK] Seq=1400 Ack=1758 Win=268800 Len=1399 TSval=2102857835 TSecr=3508698935 [TCP PDU reassembled in 179]"
"178","2.238902925","142.250.75.142","10.0.0.6","TCP","2864","0x018","1050","0x80","","443  >  58082 [PSH, ACK] Seq=2799 Ack=1758 Win=268800 Len=2798 TSval=2102857835 TSecr=3508698935 [TCP PDU reassembled in 179]"
"179","2.238902949","142.250.75.142","10.0.0.6","TLSv1.3","2327","0x018","1050","0x80","TLS 1.2","Application Data"
"180","2.238932020","10.0.0.6","142.250.75.142","TCP","66","0x010","546","0x00","","58082  >  443 [ACK] Seq=1758 Ack=2799 Win=69888 Len=0 TSval=3508699001 TSecr=2102857835"
"181","2.238999319","10.0.0.6","142.250.75.142","TCP","66","0x010","577","0x00","","58082  >  443 [ACK] Seq=1758 Ack=7858 Win=73856 Len=0 TSval=3508699001 TSecr=2102857835"
"182","2.239464707","188.125.72.139","10.0.0.6","TLSv1.2","192","0x018","1432","0x00","TLS 1.2","Application Data"
"183","2.239464816","188.125.72.139","10.0.0.6","TLSv1.2","169","0x018","1432","0x00","TLS 1.2","Application Data"
"184","2.239472815","10.0.0.6","188.125.72.139","TCP","66","0x010","690","0x00","","53246  >  443 [ACK] Seq=3158 Ack=166 Win=690 Len=0 TSval=4055460608 TSecr=2730655686"
"185","2.239543133","10.0.0.6","188.125.72.139","TCP","66","0x010","690","0x00","","53246  >  443 [ACK] Seq=3158 Ack=269 Win=690 Len=0 TSval=4055460608 TSecr=2730655686"
"186","2.239910272","188.125.72.139","10.0.0.6","TCP","66","0x010","1432","0x00","","443  >  53246 [ACK] Seq=269 Ack=3158 Win=1432 Len=0 TSval=2730655691 TSecr=4055460519"
"187","2.242307973","188.125.72.139","10.0.0.6","TLSv1.2","169","0x018","1432","0x00","TLS 1.2","Application Data"
"188","2.242323733","10.0.0.6","188.125.72.139","TCP","66","0x010","690","0x00","","53246  >  443 [ACK] Seq=3158 Ack=372 Win=690 Len=0 TSval=4055460611 TSecr=2730655693"
"189","2.244649235","87.248.116.12","10.0.0.6","TCP","66","0x010","23","0x00","","443  >  42042 [ACK] Seq=40 Ack=2704 Win=23 Len=0 TSval=3398549274 TSecr=2340454331"
"190","2.245275494","188.125.72.139","10.0.0.6","TLSv1.2","169","0x018","1432","0x00","TLS 1.2","Application Data"
"191","2.245275657","87.248.116.12","10.0.0.6","TCP","66","0x010","23","0x00","","443  >  42042 [ACK] Seq=40 Ack=5068 Win=23 Len=0 TSval=3398549276 TSecr=2340454331"
"192","2.245275702","87.248.116.12","10.0.0.6","TCP","66","0x010","23","0x00","","443  >  42042 [ACK] Seq=40 Ack=7890 Win=23 Len=0 TSval=3398549277 TSecr=2340454333"
"193","2.245302475","10.0.0.6","188.125.72.139","TCP","66","0x010","690","0x00","","53246  >  443 [ACK] Seq=3158 Ack=475 Win=690 Len=0 TSval=4055460614 TSecr=2730655695"
"194","2.246768970","178.250.7.48","10.0.0.6","TCP","74","0x012","65160","0x00","","443  >  53938 [SYN, ACK] Seq=0 Ack=1 Win=65160 Len=0 MSS=1452 SACK_PERM TSval=607927811 TSecr=720068898 WS=1024"
"195","2.246789155","10.0.0.6","178.250.7.48","TCP","66","0x010","502","0x00","","53938  >  443 [ACK] Seq=1 Ack=1 Win=64256 Len=0 TSval=720068960 TSecr=607927811"
"196","2.247825882","10.0.0.6","142.250.75.142","TLSv1.3","140","0x018","577","0x00","TLS 1.2,TLS 1.2","Change Cipher Spec, Application Data"
"197","2.248059145","10.0.0.6","188.125.72.139","TLSv1.2","101","0x018","690","0x00","TLS 1.2","Application Data"
"198","2.250620954","10.0.0.6","178.250.7.48","TLSv1.3","1793","0x018","502","0x00","TLS 1.0","Client Hello (SNI=bidder.criteo.com)"
"199","2.251288986","3.78.168.176","10.0.0.6","TCP","66","0x010","27","0x00","","443  >  33232 [ACK] Seq=1 Ack=623 Win=27 Len=0 TSval=1976155025 TSecr=2132379348"
"200","2.251480221","3.78.168.176","10.0.0.6","TLSv1.2","105","0x018","27","0x00","TLS 1.2","Application Data"
"201","2.251489918","10.0.0.6","3.78.168.176","TCP","66","0x010","646","0x00","","33232  >  443 [ACK] Seq=6149 Ack=40 Win=646 Len=0 TSval=2132379413 TSecr=1976155026"
"202","2.252005789","10.0.0.6","142.250.75.142","TLSv1.3","158","0x018","577","0x00","TLS 1.2","Application Data"
"203","2.252369149","10.0.0.6","142.250.75.142","TLSv1.3","1611","0x018","577","0x00","TLS 1.2","Application Data"
"204","2.252698242","3.78.168.176","10.0.0.6","TCP","66","0x010","27","0x00","","443  >  33232 [ACK] Seq=40 Ack=2063 Win=27 Len=0 TSval=1976155027 TSecr=2132379349"
"205","2.254284373","3.78.168.176","10.0.0.6","TCP","66","0x010","27","0x00","","443  >  33232 [ACK] Seq=40 Ack=4943 Win=27 Len=0 TSval=1976155029 TSecr=2132379349"
"206","2.254284459","142.250.75.142","10.0.0.6","TCP","66","0x010","1050","0x80","","443  >  58082 [ACK] Seq=7858 Ack=1832 Win=268800 Len=0 TSval=2102857854 TSecr=3508699010"
"207","2.254961673","3.78.168.176","10.0.0.6","TLSv1.2","114","0x018","27","0x00","TLS 1.2","Application Data"
"208","2.254976724","10.0.0.6","3.78.168.176","TCP","66","0x010","646","0x00","","33232  >  443 [ACK] Seq=6149 Ack=88 Win=646 Len=0 TSval=2132379416 TSecr=1976155029"
"209","2.256457146","142.250.75.142","10.0.0.6","TLSv1.3","1026","0x018","1050","0x80","TLS 1.2,TLS 1.2","Application Data, Application Data"
"210","2.256457243","142.250.75.142","10.0.0.6","TLSv1.3","97","0x018","1050","0x80","TLS 1.2","Application Data"
"211","2.256526370","10.0.0.6","142.250.75.142","TCP","66","0x010","599","0x00","","58082  >  443 [ACK] Seq=3469 Ack=8849 Win=76672 Len=0 TSval=3508699019 TSecr=2102857854"
"212","2.256981489","10.0.0.6","142.250.75.142","TLSv1.3","97","0x018","599","0x00","TLS 1.2","Application Data"
"213","2.258548068","142.250.75.142","10.0.0.6","TCP","66","0x010","1050","0x80","","443  >  58082 [ACK] Seq=8849 Ack=3469 Win=268800 Len=0 TSval=2102857858 TSecr=3508699015"
"214","2.259267441","10.0.0.6","34.149.50.64","UDP","74","","","0x00","","37554  >  443 Len=32"
"215","2.267262360","142.250.75.142","10.0.0.6","TCP","66","0x010","1050","0x80","","443  >  58082 [ACK] Seq=8849 Ack=3500 Win=268800 Len=0 TSval=2102857867 TSecr=3508699019"
"216","2.272704286","199.232.81.44","10.0.0.6","TCP","66","0x010","564","0x00","","443  >  57486 [ACK] Seq=1 Ack=91 Win=564 Len=0 TSval=1635634454 TSecr=201384130"
"217","2.273374118","199.232.81.44","10.0.0.6","TCP","66","0x010","564","0x00","","443  >  57486 [ACK] Seq=1 Ack=130 Win=564 Len=0 TSval=1635634455 TSecr=201384131"
"218","2.273374233","199.232.81.44","10.0.0.6","TLSv1.2","105","0x018","564","0x00","TLS 1.2","Application Data"
"219","2.273398581","10.0.0.6","199.232.81.44","TCP","66","0x010","777","0x00","","57486  >  443 [ACK] Seq=3493 Ack=40 Win=777 Len=0 TSval=201384190 TSecr=1635634455"
"220","2.274057781","199.232.81.44","10.0.0.6","TCP","66","0x010","575","0x00","","443  >  57486 [ACK] Seq=40 Ack=3010 Win=575 Len=0 TSval=1635634456 TSecr=201384131"
"221","2.274808805","199.232.81.44","10.0.0.6","TCP","66","0x010","581","0x00","","443  >  57486 [ACK] Seq=40 Ack=3493 Win=581 Len=0 TSval=1635634456 TSecr=201384131"
"222","2.293363953","69.173.156.139","10.0.0.6","TCP","74","0x012","14600","0x00","","443  >  47936 [SYN, ACK] Seq=0 Ack=1 Win=14600 Len=0 MSS=1452 WS=4 SACK_PERM TSval=2757366937 TSecr=1398021537"
"223","2.293483545","10.0.0.6","69.173.156.139","TCP","66","0x010","502","0x00","","47936  >  443 [ACK] Seq=1 Ack=1 Win=64256 Len=0 TSval=1398021608 TSecr=2757366937"
"224","2.294926212","10.0.0.6","69.173.156.139","TLSv1.3","2106","0x018","502","0x00","TLS 1.0","Client Hello (SNI=fastlane.rubiconproject.com)"
"225","2.299915986","HeightsTelec_bb:60:dc","Broadcast","ARP","60","","","","","Who has 10.0.0.28? Tell 10.0.0.138"
"226","2.299916182","52.214.234.187","10.0.0.6","TCP","66","0x010","425","0x00","","443  >  56600 [ACK] Seq=1 Ack=233 Win=425 Len=0 TSval=3655080471 TSecr=3979987705"
"227","2.299916243","52.214.234.187","10.0.0.6","TLSv1.2","112","0x018","425","0x00","TLS 1.2","Application Data"
"228","2.299916281","52.214.234.187","10.0.0.6","TCP","66","0x010","425","0x00","","443  >  56600 [ACK] Seq=47 Ack=2522 Win=425 Len=0 TSval=3655080473 TSecr=3979987705"
"229","2.299916321","52.214.234.187","10.0.0.6","TCP","66","0x010","425","0x00","","443  >  56600 [ACK] Seq=47 Ack=4813 Win=425 Len=0 TSval=3655080473 TSecr=3979987705"
"230","2.301458845","52.214.234.187","10.0.0.6","TLSv1.2","484","0x018","425","0x00","TLS 1.2","Application Data"
"231","2.301458995","52.214.234.187","10.0.0.6","TLSv1.2","104","0x018","425","0x00","TLS 1.2","Application Data"
"232","2.301547476","10.0.0.6","52.214.234.187","TCP","66","0x010","603","0x00","","56600  >  443 [ACK] Seq=4813 Ack=503 Win=603 Len=0 TSval=3979987781 TSecr=3655080472"
"233","2.303552662","10.0.0.6","52.214.234.187","TLSv1.2","108","0x018","603","0x00","TLS 1.2","Application Data"
"234","2.310230281","142.250.75.74","10.0.0.6","QUIC","1288","","","0x80","","Protected Payload (KP0)"
"235","2.310230842","142.250.75.74","10.0.0.6","QUIC","1292","","","0x80","","Protected Payload (KP0)"
"236","2.310230891","142.250.75.74","10.0.0.6","QUIC","1292","","","0x80","","Protected Payload (KP0)"
"237","2.310230939","142.250.75.74","10.0.0.6","QUIC","1292","","","0x80","","Protected Payload (KP0)"
"238","2.310230988","142.250.75.74","10.0.0.6","QUIC","1292","","","0x80","","Protected Payload (KP0)"
"239","2.310231037","142.250.75.74","10.0.0.6","QUIC","1292","","","0x80","","Protected Payload (KP0)"
"240","2.310231085","142.250.75.74","10.0.0.6","QUIC","1292","","","0x80","","Protected Payload (KP0)"
"241","2.310231134","142.250.75.74","10.0.0.6","QUIC","343","","","0x80","","Protected Payload (KP0)"
"242","2.310468352","142.250.75.74","10.0.0.6","QUIC","276","","","0x80","","Protected Payload (KP0)"
"243","2.310957189","10.0.0.6","142.250.75.74","QUIC","79","","","0x00","","Protected Payload (KP0), DCID=eb0c6237ae7da0eb"
"244","2.311656820","10.0.0.6","142.250.75.74","QUIC","75","","","0x00","","Protected Payload (KP0), DCID=eb0c6237ae7da0eb"
"245","2.312031753","52.214.234.187","10.0.0.6","TLSv1.2","2560","0x018","425","0x00","TLS 1.2","Application Data"
"246","2.312032038","52.214.234.187","10.0.0.6","TLSv1.2","104","0x018","425","0x00","TLS 1.2","Application Data"
"247","2.312300870","10.0.0.6","142.250.75.74","QUIC","75","","","0x00","","Protected Payload (KP0), DCID=eb0c6237ae7da0eb"
"248","2.312679199","10.0.0.6","142.250.75.74","QUIC","75","","","0x00","","Protected Payload (KP0), DCID=eb0c6237ae7da0eb"
"249","2.312892104","10.0.0.6","142.250.75.74","QUIC","75","","","0x00","","Protected Payload (KP0), DCID=eb0c6237ae7da0eb"
"250","2.313153219","178.250.7.48","10.0.0.6","TCP","66","0x010","63","0x00","","443  >  53938 [ACK] Seq=1 Ack=1728 Win=64512 Len=0 TSval=607927878 TSecr=720068964"
"251","2.314194948","10.0.0.6","52.214.234.187","TCP","66","0x010","603","0x00","","56600  >  443 [ACK] Seq=4855 Ack=3035 Win=603 Len=0 TSval=3979987793 TSecr=3655080481"
"252","2.315428399","178.250.7.48","10.0.0.6","TLSv1.3","1465","0x010","63","0x00","TLS 1.2,TLS 1.2,TLS 1.2","Server Hello, Change Cipher Spec, Application Data"
"253","2.315445932","10.0.0.6","178.250.7.48","TCP","66","0x010","524","0x00","","53938  >  443 [ACK] Seq=1728 Ack=1400 Win=67072 Len=0 TSval=720069029 TSecr=607927878"
"254","2.315611121","178.250.7.48","10.0.0.6","TCP","1465","0x018","63","0x00","","443  >  53938 [PSH, ACK] Seq=1400 Ack=1728 Win=64512 Len=1399 TSval=607927878 TSecr=720068964 [TCP PDU reassembled in 255]"
"255","2.315611222","178.250.7.48","10.0.0.6","TLSv1.3","478","0x018","63","0x00","TLS 1.2,TLS 1.2,TLS 1.2","Application Data, Application Data, Application Data"
"256","2.315627231","10.0.0.6","178.250.7.48","TCP","66","0x010","546","0x00","","53938  >  443 [ACK] Seq=1728 Ack=2799 Win=69888 Len=0 TSval=720069029 TSecr=607927878"
"257","2.315702009","10.0.0.6","178.250.7.48","TCP","66","0x010","568","0x00","","53938  >  443 [ACK] Seq=1728 Ack=3211 Win=72704 Len=0 TSval=720069029 TSecr=607927878"
"258","2.316473400","10.0.0.6","178.250.7.48","TLSv1.3","130","0x018","568","0x00","TLS 1.2,TLS 1.2","Change Cipher Spec, Application Data"
"259","2.317070948","10.0.0.6","178.250.7.48","TLSv1.3","158","0x018","568","0x00","TLS 1.2","Application Data"
"260","2.317364032","10.0.0.6","178.250.7.48","TLSv1.3","819","0x018","568","0x00","TLS 1.2","Application Data"
"261","2.317577038","10.0.0.6","178.250.7.48","TCP","2946","0x018","568","0x00","","53938  >  443 [PSH, ACK] Seq=2637 Ack=3211 Win=72704 Len=2880 TSval=720069031 TSecr=607927878 [TCP PDU reassembled in 262]"
"262","2.318916655","10.0.0.6","178.250.7.48","TLSv1.3","1393","0x018","568","0x00","TLS 1.2","Application Data"
"263","2.338599572","10.0.0.6","142.250.75.74","QUIC","76","","","0x00","","Protected Payload (KP0), DCID=eb0c6237ae7da0eb"
"264","2.348803026","142.250.75.74","10.0.0.6","QUIC","66","","","0x80","","Protected Payload (KP0)"
"265","2.348803348","142.250.75.74","10.0.0.6","QUIC","64","","","0x80","","Protected Payload (KP0)"
"266","2.348803390","35.227.252.103","10.0.0.6","UDP","423","","","0x80","","443  >  47848 Len=381"
"267","2.349136327","143.244.200.230","10.0.0.6","TCP","66","0x010","656","0x00","","443  >  53072 [ACK] Seq=1 Ack=9381 Win=656 Len=0 TSval=702557579 TSecr=1468380077"
"268","2.349136400","143.244.200.230","10.0.0.6","TLSv1.2","105","0x018","658","0x00","TLS 1.2","Application Data"
"269","2.349136437","143.244.200.230","10.0.0.6","TCP","66","0x010","658","0x00","","443  >  53072 [ACK] Seq=40 Ack=12157 Win=658 Len=0 TSval=702557580 TSecr=1468380077"
"270","2.349172252","10.0.0.6","143.244.200.230","TCP","2842","0x018","685","0x00","","53072  >  443 [PSH, ACK] Seq=12157 Ack=1 Win=685 Len=2776 TSval=1468380220 TSecr=702557579 [TCP PDU reassembled in 271]"
"271","2.349443768","10.0.0.6","143.244.200.230","TLSv1.2","2842","0x018","685","0x00","TLS 1.2,TLS 1.2","Application Data, Application Data"
"272","2.349596268","10.0.0.6","143.244.200.230","TCP","66","0x010","685","0x00","","53072  >  443 [ACK] Seq=17709 Ack=40 Win=685 Len=0 TSval=1468380221 TSecr=702557580"
"273","2.349821901","10.0.0.6","143.244.200.230","TLSv1.2","1271","0x018","685","0x00","TLS 1.2","Application Data"
"274","2.350349756","10.0.0.6","142.250.75.74","QUIC","75","","","0x00","","Protected Payload (KP0), DCID=eb0c6237ae7da0eb"
"275","2.365429478","69.173.156.139","10.0.0.6","TCP","66","0x010","5596","0x00","","443  >  47936 [ACK] Seq=1 Ack=2041 Win=22384 Len=0 TSval=2757366955 TSecr=1398021609"
"276","2.368703766","69.173.156.139","10.0.0.6","TLSv1.3","205","0x018","6295","0x00","TLS 1.2,TLS 1.2","Server Hello, Change Cipher Spec"
"277","2.368756854","10.0.0.6","69.173.156.139","TCP","66","0x010","501","0x00","","47936  >  443 [ACK] Seq=2041 Ack=140 Win=64128 Len=0 TSval=1398021683 TSecr=2757366956"
"278","2.369212191","69.173.156.139","10.0.0.6","TLSv1.3","103","0x018","6995","0x00","TLS 1.2","Application Data"
"279","2.369212341","69.173.156.139","10.0.0.6","TLSv1.3","140","0x018","7694","0x00","TLS 1.2","Application Data"
"280","2.369237745","10.0.0.6","69.173.156.139","TCP","66","0x010","501","0x00","","47936  >  443 [ACK] Seq=2041 Ack=177 Win=64128 Len=0 TSval=1398021684 TSecr=2757366956"
"281","2.369377333","10.0.0.6","69.173.156.139","TCP","66","0x010","501","0x00","","47936  >  443 [ACK] Seq=2041 Ack=251 Win=64128 Len=0 TSval=1398021684 TSecr=2757366956"
