"No.","Time","Source","Destination","Protocol","Length","Flags","Window","Differentiated Services Field","Version","Info"
"1","0.000000","10.0.0.2","230.0.0.1","UDP","92","","","0x00","","50394  >  6666 Len=50"
"2","0.035339","2a03:2880:f242:1c7:face:b00c:0:7260","2a06:c701:423c:b800:e516:82b3:32ae:664d","SSL","525","0x018","528","","","Continuation Data"
"3","0.039861","2a06:c701:423c:b800:e516:82b3:32ae:664d","2a03:2880:f242:1c7:face:b00c:0:7260","SSL","124","0x018","1027","","","Continuation Data"
"4","0.040630","2a06:c701:423c:b800:e516:82b3:32ae:664d","2a03:2880:f242:1c7:face:b00c:0:7260","SSL","319","0x018","1027","","","Continuation Data"
"5","0.045946","2a06:c701:423c:b800:e516:82b3:32ae:664d","2a03:2880:f242:1c2:face:b00c:0:167","TLSv1.2","238","0x018","8199","","TLS 1.2","Application Data"
"6","0.094047","2a03:2880:f242:1c7:face:b00c:0:7260","2a06:c701:423c:b800:e516:82b3:32ae:664d","TCP","74","0x010","528","","","443  >  65211 [ACK] Seq=452 Ack=51 Win=528 Len=0"
"7","0.094047","2a03:2880:f242:1c7:face:b00c:0:7260","2a06:c701:423c:b800:e516:82b3:32ae:664d","TCP","74","0x010","538","","","443  >  65211 [ACK] Seq=452 Ack=296 Win=538 Len=0"
"8","0.100743","2a03:2880:f242:1c2:face:b00c:0:167","2a06:c701:423c:b800:e516:82b3:32ae:664d","TLSv1.2","109","0x018","294","","TLS 1.2","Application Data"
"9","0.100743","2a03:2880:f242:1c2:face:b00c:0:167","2a06:c701:423c:b800:e516:82b3:32ae:664d","TLSv1.2","217","0x018","294","","TLS 1.2","Application Data"
"10","0.100743","2a03:2880:f242:1c2:face:b00c:0:167","2a06:c701:423c:b800:e516:82b3:32ae:664d","TCP","1466","0x010","294","","","443  >  49693 [ACK] Seq=179 Ack=165 Win=294 Len=1392 [TCP PDU reassembled in 11]"
"11","0.100743","2a03:2880:f242:1c2:face:b00c:0:167","2a06:c701:423c:b800:e516:82b3:32ae:664d","TLSv1.2","1466","0x010","294","","TLS 1.2","Application Data"
"12","0.100934","2a06:c701:423c:b800:e516:82b3:32ae:664d","2a03:2880:f242:1c2:face:b00c:0:167","TCP","74","0x010","8199","","","49693  >  443 [ACK] Seq=165 Ack=2963 Win=8199 Len=0"
"13","0.102846","2a03:2880:f242:1c2:face:b00c:0:167","2a06:c701:423c:b800:e516:82b3:32ae:664d","TCP","1466","0x010","294","","","443  >  49693 [ACK] Seq=2963 Ack=165 Win=294 Len=1392 [TCP PDU reassembled in 22]"
"14","0.102846","2a03:2880:f242:1c2:face:b00c:0:167","2a06:c701:423c:b800:e516:82b3:32ae:664d","TCP","1466","0x010","294","","","443  >  49693 [ACK] Seq=4355 Ack=165 Win=294 Len=1392 [TCP PDU reassembled in 22]"
"15","0.102846","2a03:2880:f242:1c2:face:b00c:0:167","2a06:c701:423c:b800:e516:82b3:32ae:664d","TCP","1466","0x010","294","","","443  >  49693 [ACK] Seq=5747 Ack=165 Win=294 Len=1392 [TCP PDU reassembled in 22]"
"16","0.102846","2a03:2880:f242:1c2:face:b00c:0:167","2a06:c701:423c:b800:e516:82b3:32ae:664d","TCP","1466","0x010","294","","","443  >  49693 [ACK] Seq=7139 Ack=165 Win=294 Len=1392 [TCP PDU reassembled in 22]"
"17","0.102846","2a03:2880:f242:1c2:face:b00c:0:167","2a06:c701:423c:b800:e516:82b3:32ae:664d","TCP","1466","0x010","294","","","443  >  49693 [ACK] Seq=8531 Ack=165 Win=294 Len=1392 [TCP PDU reassembled in 22]"
"18","0.102846","2a03:2880:f242:1c2:face:b00c:0:167","2a06:c701:423c:b800:e516:82b3:32ae:664d","TCP","1466","0x010","294","","","443  >  49693 [ACK] Seq=9923 Ack=165 Win=294 Len=1392 [TCP PDU reassembled in 22]"
"19","0.102846","2a03:2880:f242:1c2:face:b00c:0:167","2a06:c701:423c:b800:e516:82b3:32ae:664d","TCP","1466","0x010","294","","","443  >  49693 [ACK] Seq=11315 Ack=165 Win=294 Len=1392 [TCP PDU reassembled in 22]"
"20","0.102846","2a03:2880:f242:1c2:face:b00c:0:167","2a06:c701:423c:b800:e516:82b3:32ae:664d","TCP","1466","0x010","294","","","443  >  49693 [ACK] Seq=12707 Ack=165 Win=294 Len=1392 [TCP PDU reassembled in 22]"
"21","0.102846","2a03:2880:f242:1c2:face:b00c:0:167","2a06:c701:423c:b800:e516:82b3:32ae:664d","TCP","1466","0x010","294","","","443  >  49693 [ACK] Seq=14099 Ack=165 Win=294 Len=1392 [TCP PDU reassembled in 22]"
"22","0.102846","2a03:2880:f242:1c2:face:b00c:0:167","2a06:c701:423c:b800:e516:82b3:32ae:664d","TLSv1.2","1466","0x010","294","","TLS 1.2","Application Data"
"23","0.102846","2a03:2880:f242:1c2:face:b00c:0:167","2a06:c701:423c:b800:e516:82b3:32ae:664d","TLSv1.2","1466","0x010","294","","TLS 1.2","Application Data"
"24","0.102846","2a03:2880:f242:1c2:face:b00c:0:167","2a06:c701:423c:b800:e516:82b3:32ae:664d","TCP","1466","0x010","294","","","443  >  49693 [ACK] Seq=18275 Ack=165 Win=294 Len=1392 [TCP PDU reassembled in 34]"
"25","0.102846","2a03:2880:f242:1c2:face:b00c:0:167","2a06:c701:423c:b800:e516:82b3:32ae:664d","TCP","1466","0x010","294","","","443  >  49693 [ACK] Seq=19667 Ack=165 Win=294 Len=1392 [TCP PDU reassembled in 34]"
"26","0.102846","2a03:2880:f242:1c2:face:b00c:0:167","2a06:c701:423c:b800:e516:82b3:32ae:664d","TCP","1466","0x010","294","","","443  >  49693 [ACK] Seq=21059 Ack=165 Win=294 Len=1392 [TCP PDU reassembled in 34]"
"27","0.102846","2a03:2880:f242:1c2:face:b00c:0:167","2a06:c701:423c:b800:e516:82b3:32ae:664d","TCP","1466","0x010","294","","","443  >  49693 [ACK] Seq=22451 Ack=165 Win=294 Len=1392 [TCP PDU reassembled in 34]"
"28","0.102846","2a03:2880:f242:1c2:face:b00c:0:167","2a06:c701:423c:b800:e516:82b3:32ae:664d","TCP","1466","0x010","294","","","443  >  49693 [ACK] Seq=23843 Ack=165 Win=294 Len=1392 [TCP PDU reassembled in 34]"
"29","0.102846","2a03:2880:f242:1c2:face:b00c:0:167","2a06:c701:423c:b800:e516:82b3:32ae:664d","TCP","1466","0x010","294","","","443  >  49693 [ACK] Seq=25235 Ack=165 Win=294 Len=1392 [TCP PDU reassembled in 34]"
"30","0.102846","2a03:2880:f242:1c2:face:b00c:0:167","2a06:c701:423c:b800:e516:82b3:32ae:664d","TCP","1466","0x010","294","","","443  >  49693 [ACK] Seq=26627 Ack=165 Win=294 Len=1392 [TCP PDU reassembled in 34]"
"31","0.102846","2a03:2880:f242:1c2:face:b00c:0:167","2a06:c701:423c:b800:e516:82b3:32ae:664d","TCP","1466","0x018","294","","","443  >  49693 [PSH, ACK] Seq=28019 Ack=165 Win=294 Len=1392 [TCP PDU reassembled in 34]"
"32","0.102846","2a03:2880:f242:1c2:face:b00c:0:167","2a06:c701:423c:b800:e516:82b3:32ae:664d","TCP","1466","0x010","294","","","443  >  49693 [ACK] Seq=29411 Ack=165 Win=294 Len=1392 [TCP PDU reassembled in 34]"
"33","0.102846","2a03:2880:f242:1c2:face:b00c:0:167","2a06:c701:423c:b800:e516:82b3:32ae:664d","TCP","1466","0x010","294","","","443  >  49693 [ACK] Seq=30803 Ack=165 Win=294 Len=1392 [TCP PDU reassembled in 34]"
"34","0.102846","2a03:2880:f242:1c2:face:b00c:0:167","2a06:c701:423c:b800:e516:82b3:32ae:664d","TLSv1.2","1466","0x010","294","","TLS 1.2","Application Data"
"35","0.102846","2a03:2880:f242:1c2:face:b00c:0:167","2a06:c701:423c:b800:e516:82b3:32ae:664d","TLSv1.2","1466","0x010","294","","TLS 1.2","Application Data"
"36","0.102846","2a03:2880:f242:1c2:face:b00c:0:167","2a06:c701:423c:b800:e516:82b3:32ae:664d","TCP","1466","0x010","294","","","443  >  49693 [ACK] Seq=34979 Ack=165 Win=294 Len=1392 [TCP PDU reassembled in 48]"
"37","0.102846","2a03:2880:f242:1c2:face:b00c:0:167","2a06:c701:423c:b800:e516:82b3:32ae:664d","TCP","1466","0x010","294","","","443  >  49693 [ACK] Seq=36371 Ack=165 Win=294 Len=1392 [TCP PDU reassembled in 48]"
"38","0.102846","2a03:2880:f242:1c2:face:b00c:0:167","2a06:c701:423c:b800:e516:82b3:32ae:664d","TCP","1466","0x010","294","","","443  >  49693 [ACK] Seq=37763 Ack=165 Win=294 Len=1392 [TCP PDU reassembled in 48]"
"39","0.102846","2a03:2880:f242:1c2:face:b00c:0:167","2a06:c701:423c:b800:e516:82b3:32ae:664d","TCP","1466","0x010","294","","","443  >  49693 [ACK] Seq=39155 Ack=165 Win=294 Len=1392 [TCP PDU reassembled in 48]"
"40","0.102846","2a03:2880:f242:1c2:face:b00c:0:167","2a06:c701:423c:b800:e516:82b3:32ae:664d","TCP","1466","0x010","294","","","443  >  49693 [ACK] Seq=40547 Ack=165 Win=294 Len=1392 [TCP PDU reassembled in 48]"
"41","0.103261","2a06:c701:423c:b800:e516:82b3:32ae:664d","2a03:2880:f242:1c2:face:b00c:0:167","TCP","74","0x010","8199","","","49693  >  443 [ACK] Seq=165 Ack=41939 Win=8199 Len=0"
"42","0.104141","2a03:2880:f242:1c2:face:b00c:0:167","2a06:c701:423c:b800:e516:82b3:32ae:664d","TCP","1466","0x010","294","","","443  >  49693 [ACK] Seq=41939 Ack=165 Win=294 Len=1392 [TCP PDU reassembled in 48]"
"43","0.104141","2a03:2880:f242:1c2:face:b00c:0:167","2a06:c701:423c:b800:e516:82b3:32ae:664d","TCP","1466","0x010","294","","","443  >  49693 [ACK] Seq=43331 Ack=165 Win=294 Len=1392 [TCP PDU reassembled in 48]"
"44","0.104141","2a03:2880:f242:1c2:face:b00c:0:167","2a06:c701:423c:b800:e516:82b3:32ae:664d","TCP","1466","0x010","294","","","443  >  49693 [ACK] Seq=44723 Ack=165 Win=294 Len=1392 [TCP PDU reassembled in 48]"
"45","0.104141","2a03:2880:f242:1c2:face:b00c:0:167","2a06:c701:423c:b800:e516:82b3:32ae:664d","TCP","1466","0x010","294","","","443  >  49693 [ACK] Seq=46115 Ack=165 Win=294 Len=1392 [TCP PDU reassembled in 48]"
"46","0.104249","2a06:c701:423c:b800:e516:82b3:32ae:664d","2a03:2880:f242:1c2:face:b00c:0:167","TCP","74","0x010","8199","","","49693  >  443 [ACK] Seq=165 Ack=47507 Win=8199 Len=0"
"47","0.107430","2a03:2880:f242:1c2:face:b00c:0:167","2a06:c701:423c:b800:e516:82b3:32ae:664d","TCP","1466","0x010","294","","","443  >  49693 [ACK] Seq=47507 Ack=165 Win=294 Len=1392 [TCP PDU reassembled in 48]"
"48","0.107430","2a03:2880:f242:1c2:face:b00c:0:167","2a06:c701:423c:b800:e516:82b3:32ae:664d","TLSv1.2","1466","0x010","294","","TLS 1.2","Application Data"
"49","0.107430","2a03:2880:f242:1c2:face:b00c:0:167","2a06:c701:423c:b800:e516:82b3:32ae:664d","TLSv1.2","1466","0x010","294","","TLS 1.2","Application Data"
"50","0.107430","2a03:2880:f242:1c2:face:b00c:0:167","2a06:c701:423c:b800:e516:82b3:32ae:664d","TCP","1466","0x010","294","","","443  >  49693 [ACK] Seq=51683 Ack=165 Win=294 Len=1392 [TCP PDU reassembled in 60]"
"51","0.107430","2a03:2880:f242:1c2:face:b00c:0:167","2a06:c701:423c:b800:e516:82b3:32ae:664d","TCP","1466","0x010","294","","","443  >  49693 [ACK] Seq=53075 Ack=165 Win=294 Len=1392 [TCP PDU reassembled in 60]"
"52","0.107430","2a03:2880:f242:1c2:face:b00c:0:167","2a06:c701:423c:b800:e516:82b3:32ae:664d","TCP","1466","0x010","294","","","443  >  49693 [ACK] Seq=54467 Ack=165 Win=294 Len=1392 [TCP PDU reassembled in 60]"
"53","0.107430","2a03:2880:f242:1c2:face:b00c:0:167","2a06:c701:423c:b800:e516:82b3:32ae:664d","TCP","1466","0x010","294","","","443  >  49693 [ACK] Seq=55859 Ack=165 Win=294 Len=1392 [TCP PDU reassembled in 60]"
"54","0.107430","2a03:2880:f242:1c2:face:b00c:0:167","2a06:c701:423c:b800:e516:82b3:32ae:664d","TCP","1466","0x018","294","","","443  >  49693 [PSH, ACK] Seq=57251 Ack=165 Win=294 Len=1392 [TCP PDU reassembled in 60]"
"55","0.107430","2a03:2880:f242:1c2:face:b00c:0:167","2a06:c701:423c:b800:e516:82b3:32ae:664d","TCP","1466","0x010","294","","","443  >  49693 [ACK] Seq=58643 Ack=165 Win=294 Len=1392 [TCP PDU reassembled in 60]"
"56","0.107430","2a03:2880:f242:1c2:face:b00c:0:167","2a06:c701:423c:b800:e516:82b3:32ae:664d","TCP","1466","0x010","294","","","443  >  49693 [ACK] Seq=60035 Ack=165 Win=294 Len=1392 [TCP PDU reassembled in 60]"
"57","0.107430","2a03:2880:f242:1c2:face:b00c:0:167","2a06:c701:423c:b800:e516:82b3:32ae:664d","TCP","1466","0x010","294","","","443  >  49693 [ACK] Seq=61427 Ack=165 Win=294 Len=1392 [TCP PDU reassembled in 60]"
"58","0.107430","2a03:2880:f242:1c2:face:b00c:0:167","2a06:c701:423c:b800:e516:82b3:32ae:664d","TCP","1466","0x010","294","","","443  >  49693 [ACK] Seq=62819 Ack=165 Win=294 Len=1392 [TCP PDU reassembled in 60]"
"59","0.107430","2a03:2880:f242:1c2:face:b00c:0:167","2a06:c701:423c:b800:e516:82b3:32ae:664d","TCP","1466","0x010","294","","","443  >  49693 [ACK] Seq=64211 Ack=165 Win=294 Len=1392 [TCP PDU reassembled in 60]"
"60","0.107430","2a03:2880:f242:1c2:face:b00c:0:167","2a06:c701:423c:b800:e516:82b3:32ae:664d","TLSv1.2","1466","0x010","294","","TLS 1.2","Application Data"
"61","0.107430","2a03:2880:f242:1c2:face:b00c:0:167","2a06:c701:423c:b800:e516:82b3:32ae:664d","TLSv1.2","1466","0x010","294","","TLS 1.2","Application Data"
"62","0.107430","2a03:2880:f242:1c2:face:b00c:0:167","2a06:c701:423c:b800:e516:82b3:32ae:664d","TCP","1466","0x010","294","","","443  >  49693 [ACK] Seq=68387 Ack=165 Win=294 Len=1392 [TCP PDU reassembled in 72]"
"63","0.107430","2a03:2880:f242:1c2:face:b00c:0:167","2a06:c701:423c:b800:e516:82b3:32ae:664d","TCP","1466","0x010","294","","","443  >  49693 [ACK] Seq=69779 Ack=165 Win=294 Len=1392 [TCP PDU reassembled in 72]"
"64","0.107430","2a03:2880:f242:1c2:face:b00c:0:167","2a06:c701:423c:b800:e516:82b3:32ae:664d","TCP","1466","0x010","294","","","443  >  49693 [ACK] Seq=71171 Ack=165 Win=294 Len=1392 [TCP PDU reassembled in 72]"
"65","0.107430","2a03:2880:f242:1c2:face:b00c:0:167","2a06:c701:423c:b800:e516:82b3:32ae:664d","TCP","1466","0x010","294","","","443  >  49693 [ACK] Seq=72563 Ack=165 Win=294 Len=1392 [TCP PDU reassembled in 72]"
"66","0.107430","2a03:2880:f242:1c2:face:b00c:0:167","2a06:c701:423c:b800:e516:82b3:32ae:664d","TCP","1466","0x010","294","","","443  >  49693 [ACK] Seq=73955 Ack=165 Win=294 Len=1392 [TCP PDU reassembled in 72]"
"67","0.107430","2a03:2880:f242:1c2:face:b00c:0:167","2a06:c701:423c:b800:e516:82b3:32ae:664d","TCP","1466","0x010","294","","","443  >  49693 [ACK] Seq=75347 Ack=165 Win=294 Len=1392 [TCP PDU reassembled in 72]"
"68","0.107430","2a03:2880:f242:1c2:face:b00c:0:167","2a06:c701:423c:b800:e516:82b3:32ae:664d","TCP","1466","0x010","294","","","443  >  49693 [ACK] Seq=76739 Ack=165 Win=294 Len=1392 [TCP PDU reassembled in 72]"
"69","0.107430","2a03:2880:f242:1c2:face:b00c:0:167","2a06:c701:423c:b800:e516:82b3:32ae:664d","TCP","1466","0x010","294","","","443  >  49693 [ACK] Seq=78131 Ack=165 Win=294 Len=1392 [TCP PDU reassembled in 72]"
"70","0.107430","2a03:2880:f242:1c2:face:b00c:0:167","2a06:c701:423c:b800:e516:82b3:32ae:664d","TCP","1466","0x010","294","","","443  >  49693 [ACK] Seq=79523 Ack=165 Win=294 Len=1392 [TCP PDU reassembled in 72]"
"71","0.107430","2a03:2880:f242:1c2:face:b00c:0:167","2a06:c701:423c:b800:e516:82b3:32ae:664d","TCP","1466","0x010","294","","","443  >  49693 [ACK] Seq=80915 Ack=165 Win=294 Len=1392 [TCP PDU reassembled in 72]"
"72","0.107430","2a03:2880:f242:1c2:face:b00c:0:167","2a06:c701:423c:b800:e516:82b3:32ae:664d","TLSv1.2","1466","0x010","294","","TLS 1.2","Application Data"
"73","0.107430","2a03:2880:f242:1c2:face:b00c:0:167","2a06:c701:423c:b800:e516:82b3:32ae:664d","TLSv1.2","1466","0x010","294","","TLS 1.2","Application Data"
"74","0.107430","2a03:2880:f242:1c2:face:b00c:0:167","2a06:c701:423c:b800:e516:82b3:32ae:664d","TCP","1466","0x010","294","","","443  >  49693 [ACK] Seq=85091 Ack=165 Win=294 Len=1392 [TCP PDU reassembled in 85]"
"75","0.107430","2a03:2880:f242:1c2:face:b00c:0:167","2a06:c701:423c:b800:e516:82b3:32ae:664d","TCP","1466","0x018","294","","","443  >  49693 [PSH, ACK] Seq=86483 Ack=165 Win=294 Len=1392 [TCP PDU reassembled in 85]"
"76","0.107430","2a03:2880:f242:1c2:face:b00c:0:167","2a06:c701:423c:b800:e516:82b3:32ae:664d","TCP","1466","0x010","294","","","443  >  49693 [ACK] Seq=87875 Ack=165 Win=294 Len=1392 [TCP PDU reassembled in 85]"
"77","0.107430","2a03:2880:f242:1c2:face:b00c:0:167","2a06:c701:423c:b800:e516:82b3:32ae:664d","TCP","1466","0x010","294","","","443  >  49693 [ACK] Seq=89267 Ack=165 Win=294 Len=1392 [TCP PDU reassembled in 85]"
"78","0.107430","2a03:2880:f242:1c2:face:b00c:0:167","2a06:c701:423c:b800:e516:82b3:32ae:664d","TCP","1466","0x010","294","","","443  >  49693 [ACK] Seq=90659 Ack=165 Win=294 Len=1392 [TCP PDU reassembled in 85]"
"79","0.107753","2a06:c701:423c:b800:e516:82b3:32ae:664d","2a03:2880:f242:1c2:face:b00c:0:167","TCP","74","0x010","8199","","","49693  >  443 [ACK] Seq=165 Ack=92051 Win=8199 Len=0"
"80","0.107885","2a03:2880:f242:1c2:face:b00c:0:167","2a06:c701:423c:b800:e516:82b3:32ae:664d","TCP","1466","0x010","294","","","443  >  49693 [ACK] Seq=92051 Ack=165 Win=294 Len=1392 [TCP PDU reassembled in 85]"
"81","0.107885","2a03:2880:f242:1c2:face:b00c:0:167","2a06:c701:423c:b800:e516:82b3:32ae:664d","TCP","1466","0x010","294","","","443  >  49693 [ACK] Seq=93443 Ack=165 Win=294 Len=1392 [TCP PDU reassembled in 85]"
"82","0.107885","2a03:2880:f242:1c2:face:b00c:0:167","2a06:c701:423c:b800:e516:82b3:32ae:664d","TCP","1466","0x010","294","","","443  >  49693 [ACK] Seq=94835 Ack=165 Win=294 Len=1392 [TCP PDU reassembled in 85]"
"83","0.107885","2a03:2880:f242:1c2:face:b00c:0:167","2a06:c701:423c:b800:e516:82b3:32ae:664d","TCP","1466","0x010","294","","","443  >  49693 [ACK] Seq=96227 Ack=165 Win=294 Len=1392 [TCP PDU reassembled in 85]"
"84","0.107936","2a06:c701:423c:b800:e516:82b3:32ae:664d","2a03:2880:f242:1c2:face:b00c:0:167","TCP","74","0x010","8199","","","49693  >  443 [ACK] Seq=165 Ack=97619 Win=8199 Len=0"
"85","0.113456","2a03:2880:f242:1c2:face:b00c:0:167","2a06:c701:423c:b800:e516:82b3:32ae:664d","TLSv1.2","1466","0x010","294","","TLS 1.2","Application Data"
"86","0.113456","2a03:2880:f242:1c2:face:b00c:0:167","2a06:c701:423c:b800:e516:82b3:32ae:664d","TLSv1.2","1466","0x010","294","","TLS 1.2","Application Data"
"87","0.113456","2a03:2880:f242:1c2:face:b00c:0:167","2a06:c701:423c:b800:e516:82b3:32ae:664d","TCP","1466","0x010","294","","","443  >  49693 [ACK] Seq=100403 Ack=165 Win=294 Len=1392 [TCP PDU reassembled in 97]"
"88","0.113456","2a03:2880:f242:1c2:face:b00c:0:167","2a06:c701:423c:b800:e516:82b3:32ae:664d","TCP","1466","0x010","294","","","443  >  49693 [ACK] Seq=101795 Ack=165 Win=294 Len=1392 [TCP PDU reassembled in 97]"
"89","0.113456","2a03:2880:f242:1c2:face:b00c:0:167","2a06:c701:423c:b800:e516:82b3:32ae:664d","TCP","1466","0x010","294","","","443  >  49693 [ACK] Seq=103187 Ack=165 Win=294 Len=1392 [TCP PDU reassembled in 97]"
"90","0.113456","2a03:2880:f242:1c2:face:b00c:0:167","2a06:c701:423c:b800:e516:82b3:32ae:664d","TCP","1466","0x010","294","","","443  >  49693 [ACK] Seq=104579 Ack=165 Win=294 Len=1392 [TCP PDU reassembled in 97]"
"91","0.113456","2a03:2880:f242:1c2:face:b00c:0:167","2a06:c701:423c:b800:e516:82b3:32ae:664d","TCP","1466","0x010","294","","","443  >  49693 [ACK] Seq=105971 Ack=165 Win=294 Len=1392 [TCP PDU reassembled in 97]"
"92","0.113456","2a03:2880:f242:1c2:face:b00c:0:167","2a06:c701:423c:b800:e516:82b3:32ae:664d","TCP","1466","0x010","294","","","443  >  49693 [ACK] Seq=107363 Ack=165 Win=294 Len=1392 [TCP PDU reassembled in 97]"
"93","0.113456","2a03:2880:f242:1c2:face:b00c:0:167","2a06:c701:423c:b800:e516:82b3:32ae:664d","TCP","1466","0x010","294","","","443  >  49693 [ACK] Seq=108755 Ack=165 Win=294 Len=1392 [TCP PDU reassembled in 97]"
"94","0.113456","2a03:2880:f242:1c2:face:b00c:0:167","2a06:c701:423c:b800:e516:82b3:32ae:664d","TCP","1466","0x010","294","","","443  >  49693 [ACK] Seq=110147 Ack=165 Win=294 Len=1392 [TCP PDU reassembled in 97]"
"95","0.113456","2a03:2880:f242:1c2:face:b00c:0:167","2a06:c701:423c:b800:e516:82b3:32ae:664d","TCP","1466","0x010","294","","","443  >  49693 [ACK] Seq=111539 Ack=165 Win=294 Len=1392 [TCP PDU reassembled in 97]"
"96","0.113456","2a03:2880:f242:1c2:face:b00c:0:167","2a06:c701:423c:b800:e516:82b3:32ae:664d","TCP","1466","0x010","294","","","443  >  49693 [ACK] Seq=112931 Ack=165 Win=294 Len=1392 [TCP PDU reassembled in 97]"
"97","0.113456","2a03:2880:f242:1c2:face:b00c:0:167","2a06:c701:423c:b800:e516:82b3:32ae:664d","TLSv1.2","1466","0x010","294","","TLS 1.2","Application Data"
"98","0.113456","2a03:2880:f242:1c2:face:b00c:0:167","2a06:c701:423c:b800:e516:82b3:32ae:664d","TLSv1.2","1466","0x018","294","","TLS 1.2","Application Data"
"99","0.113456","2a03:2880:f242:1c2:face:b00c:0:167","2a06:c701:423c:b800:e516:82b3:32ae:664d","TCP","1466","0x010","294","","","443  >  49693 [ACK] Seq=117107 Ack=165 Win=294 Len=1392 [TCP PDU reassembled in 109]"
"100","0.113456","2a03:2880:f242:1c2:face:b00c:0:167","2a06:c701:423c:b800:e516:82b3:32ae:664d","TCP","1466","0x010","294","","","443  >  49693 [ACK] Seq=118499 Ack=165 Win=294 Len=1392 [TCP PDU reassembled in 109]"
"101","0.113456","2a03:2880:f242:1c2:face:b00c:0:167","2a06:c701:423c:b800:e516:82b3:32ae:664d","TCP","1466","0x010","294","","","443  >  49693 [ACK] Seq=119891 Ack=165 Win=294 Len=1392 [TCP PDU reassembled in 109]"
"102","0.113456","2a03:2880:f242:1c2:face:b00c:0:167","2a06:c701:423c:b800:e516:82b3:32ae:664d","TCP","1466","0x010","294","","","443  >  49693 [ACK] Seq=121283 Ack=165 Win=294 Len=1392 [TCP PDU reassembled in 109]"
"103","0.113456","2a03:2880:f242:1c2:face:b00c:0:167","2a06:c701:423c:b800:e516:82b3:32ae:664d","TCP","1466","0x010","294","","","443  >  49693 [ACK] Seq=122675 Ack=165 Win=294 Len=1392 [TCP PDU reassembled in 109]"
"104","0.113456","2a03:2880:f242:1c2:face:b00c:0:167","2a06:c701:423c:b800:e516:82b3:32ae:664d","TCP","1466","0x010","294","","","443  >  49693 [ACK] Seq=124067 Ack=165 Win=294 Len=1392 [TCP PDU reassembled in 109]"
"105","0.113456","2a03:2880:f242:1c2:face:b00c:0:167","2a06:c701:423c:b800:e516:82b3:32ae:664d","TCP","1466","0x010","294","","","443  >  49693 [ACK] Seq=125459 Ack=165 Win=294 Len=1392 [TCP PDU reassembled in 109]"
"106","0.113456","2a03:2880:f242:1c2:face:b00c:0:167","2a06:c701:423c:b800:e516:82b3:32ae:664d","TCP","1466","0x010","294","","","443  >  49693 [ACK] Seq=126851 Ack=165 Win=294 Len=1392 [TCP PDU reassembled in 109]"
"107","0.113456","2a03:2880:f242:1c2:face:b00c:0:167","2a06:c701:423c:b800:e516:82b3:32ae:664d","TCP","1466","0x010","294","","","443  >  49693 [ACK] Seq=128243 Ack=165 Win=294 Len=1392 [TCP PDU reassembled in 109]"
"108","0.113456","2a03:2880:f242:1c2:face:b00c:0:167","2a06:c701:423c:b800:e516:82b3:32ae:664d","TCP","1466","0x010","294","","","443  >  49693 [ACK] Seq=129635 Ack=165 Win=294 Len=1392 [TCP PDU reassembled in 109]"
"109","0.113456","2a03:2880:f242:1c2:face:b00c:0:167","2a06:c701:423c:b800:e516:82b3:32ae:664d","TLSv1.2","1466","0x010","294","","TLS 1.2","Application Data"
"110","0.113456","2a03:2880:f242:1c2:face:b00c:0:167","2a06:c701:423c:b800:e516:82b3:32ae:664d","TLSv1.2","1466","0x010","294","","TLS 1.2","Application Data"
"111","0.113456","2a03:2880:f242:1c2:face:b00c:0:167","2a06:c701:423c:b800:e516:82b3:32ae:664d","TCP","1466","0x010","294","","","443  >  49693 [ACK] Seq=133811 Ack=165 Win=294 Len=1392 [TCP PDU reassembled in 123]"
"112","0.113456","2a03:2880:f242:1c2:face:b00c:0:167","2a06:c701:423c:b800:e516:82b3:32ae:664d","TCP","1466","0x010","294","","","443  >  49693 [ACK] Seq=135203 Ack=165 Win=294 Len=1392 [TCP PDU reassembled in 123]"
"113","0.113456","2a03:2880:f242:1c2:face:b00c:0:167","2a06:c701:423c:b800:e516:82b3:32ae:664d","TCP","1466","0x010","294","","","443  >  49693 [ACK] Seq=136595 Ack=165 Win=294 Len=1392 [TCP PDU reassembled in 123]"
"114","0.113456","2a03:2880:f242:1c2:face:b00c:0:167","2a06:c701:423c:b800:e516:82b3:32ae:664d","TCP","1466","0x010","294","","","443  >  49693 [ACK] Seq=137987 Ack=165 Win=294 Len=1392 [TCP PDU reassembled in 123]"
"115","0.113456","2a03:2880:f242:1c2:face:b00c:0:167","2a06:c701:423c:b800:e516:82b3:32ae:664d","TCP","1466","0x010","294","","","443  >  49693 [ACK] Seq=139379 Ack=165 Win=294 Len=1392 [TCP PDU reassembled in 123]"
"116","0.113456","2a03:2880:f242:1c2:face:b00c:0:167","2a06:c701:423c:b800:e516:82b3:32ae:664d","TCP","1466","0x010","294","","","443  >  49693 [ACK] Seq=140771 Ack=165 Win=294 Len=1392 [TCP PDU reassembled in 123]"
"117","0.113923","2a06:c701:423c:b800:e516:82b3:32ae:664d","2a03:2880:f242:1c2:face:b00c:0:167","TCP","74","0x010","8199","","","49693  >  443 [ACK] Seq=165 Ack=142163 Win=8199 Len=0"
"118","0.114057","2a03:2880:f242:1c2:face:b00c:0:167","2a06:c701:423c:b800:e516:82b3:32ae:664d","TCP","1466","0x010","294","","","443  >  49693 [ACK] Seq=142163 Ack=165 Win=294 Len=1392 [TCP PDU reassembled in 123]"
"119","0.114057","2a03:2880:f242:1c2:face:b00c:0:167","2a06:c701:423c:b800:e516:82b3:32ae:664d","TCP","1466","0x010","294","","","443  >  49693 [ACK] Seq=143555 Ack=165 Win=294 Len=1392 [TCP PDU reassembled in 123]"
"120","0.114057","2a03:2880:f242:1c2:face:b00c:0:167","2a06:c701:423c:b800:e516:82b3:32ae:664d","TCP","1466","0x018","294","","","443  >  49693 [PSH, ACK] Seq=144947 Ack=165 Win=294 Len=1392 [TCP PDU reassembled in 123]"
"121","0.114057","2a03:2880:f242:1c2:face:b00c:0:167","2a06:c701:423c:b800:e516:82b3:32ae:664d","TCP","1466","0x010","294","","","443  >  49693 [ACK] Seq=146339 Ack=165 Win=294 Len=1392 [TCP PDU reassembled in 123]"
"122","0.114126","2a06:c701:423c:b800:e516:82b3:32ae:664d","2a03:2880:f242:1c2:face:b00c:0:167","TCP","74","0x010","8199","","","49693  >  443 [ACK] Seq=165 Ack=147731 Win=8199 Len=0"
"123","0.115884","2a03:2880:f242:1c2:face:b00c:0:167","2a06:c701:423c:b800:e516:82b3:32ae:664d","TLSv1.2","1466","0x010","294","","TLS 1.2","Application Data"
"124","0.115884","2a03:2880:f242:1c2:face:b00c:0:167","2a06:c701:423c:b800:e516:82b3:32ae:664d","TLSv1.2","1466","0x010","294","","TLS 1.2","Application Data"
"125","0.115884","2a03:2880:f242:1c2:face:b00c:0:167","2a06:c701:423c:b800:e516:82b3:32ae:664d","TCP","1466","0x010","294","","","443  >  49693 [ACK] Seq=150515 Ack=165 Win=294 Len=1392 [TCP PDU reassembled in 135]"
"126","0.115884","2a03:2880:f242:1c2:face:b00c:0:167","2a06:c701:423c:b800:e516:82b3:32ae:664d","TCP","1466","0x010","294","","","443  >  49693 [ACK] Seq=151907 Ack=165 Win=294 Len=1392 [TCP PDU reassembled in 135]"
"127","0.115884","2a03:2880:f242:1c2:face:b00c:0:167","2a06:c701:423c:b800:e516:82b3:32ae:664d","TCP","1466","0x010","294","","","443  >  49693 [ACK] Seq=153299 Ack=165 Win=294 Len=1392 [TCP PDU reassembled in 135]"
"128","0.115884","2a03:2880:f242:1c2:face:b00c:0:167","2a06:c701:423c:b800:e516:82b3:32ae:664d","TCP","1466","0x010","294","","","443  >  49693 [ACK] Seq=154691 Ack=165 Win=294 Len=1392 [TCP PDU reassembled in 135]"
"129","0.115884","2a03:2880:f242:1c2:face:b00c:0:167","2a06:c701:423c:b800:e516:82b3:32ae:664d","TCP","1466","0x010","294","","","443  >  49693 [ACK] Seq=156083 Ack=165 Win=294 Len=1392 [TCP PDU reassembled in 135]"
"130","0.115884","2a03:2880:f242:1c2:face:b00c:0:167","2a06:c701:423c:b800:e516:82b3:32ae:664d","TCP","1466","0x010","294","","","443  >  49693 [ACK] Seq=157475 Ack=165 Win=294 Len=1392 [TCP PDU reassembled in 135]"
"131","0.115884","2a03:2880:f242:1c2:face:b00c:0:167","2a06:c701:423c:b800:e516:82b3:32ae:664d","TCP","1466","0x010","294","","","443  >  49693 [ACK] Seq=158867 Ack=165 Win=294 Len=1392 [TCP PDU reassembled in 135]"
"132","0.115884","2a03:2880:f242:1c2:face:b00c:0:167","2a06:c701:423c:b800:e516:82b3:32ae:664d","TCP","1466","0x010","294","","","443  >  49693 [ACK] Seq=160259 Ack=165 Win=294 Len=1392 [TCP PDU reassembled in 135]"
"133","0.115884","2a03:2880:f242:1c2:face:b00c:0:167","2a06:c701:423c:b800:e516:82b3:32ae:664d","TCP","1466","0x010","294","","","443  >  49693 [ACK] Seq=161651 Ack=165 Win=294 Len=1392 [TCP PDU reassembled in 135]"
"134","0.115884","2a03:2880:f242:1c2:face:b00c:0:167","2a06:c701:423c:b800:e516:82b3:32ae:664d","TCP","1466","0x010","294","","","443  >  49693 [ACK] Seq=163043 Ack=165 Win=294 Len=1392 [TCP PDU reassembled in 135]"
"135","0.115884","2a03:2880:f242:1c2:face:b00c:0:167","2a06:c701:423c:b800:e516:82b3:32ae:664d","TLSv1.2","1466","0x010","294","","TLS 1.2","Application Data"
"136","0.115884","2a03:2880:f242:1c2:face:b00c:0:167","2a06:c701:423c:b800:e516:82b3:32ae:664d","TLSv1.2","1466","0x010","294","","TLS 1.2","Application Data"
"137","0.115884","2a03:2880:f242:1c2:face:b00c:0:167","2a06:c701:423c:b800:e516:82b3:32ae:664d","TCP","1466","0x010","294","","","443  >  49693 [ACK] Seq=167219 Ack=165 Win=294 Len=1392 [TCP PDU reassembled in 146]"
"138","0.115884","2a03:2880:f242:1c2:face:b00c:0:167","2a06:c701:423c:b800:e516:82b3:32ae:664d","TCP","1466","0x010","294","","","443  >  49693 [ACK] Seq=168611 Ack=165 Win=294 Len=1392 [TCP PDU reassembled in 146]"
"139","0.115884","2a03:2880:f242:1c2:face:b00c:0:167","2a06:c701:423c:b800:e516:82b3:32ae:664d","TCP","1466","0x010","294","","","443  >  49693 [ACK] Seq=170003 Ack=165 Win=294 Len=1392 [TCP PDU reassembled in 146]"
"140","0.115884","2a03:2880:f242:1c2:face:b00c:0:167","2a06:c701:423c:b800:e516:82b3:32ae:664d","TCP","1466","0x010","294","","","443  >  49693 [ACK] Seq=171395 Ack=165 Win=294 Len=1392 [TCP PDU reassembled in 146]"
"141","0.115884","2a03:2880:f242:1c2:face:b00c:0:167","2a06:c701:423c:b800:e516:82b3:32ae:664d","TCP","1466","0x010","294","","","443  >  49693 [ACK] Seq=172787 Ack=165 Win=294 Len=1392 [TCP PDU reassembled in 146]"
"142","0.115884","2a03:2880:f242:1c2:face:b00c:0:167","2a06:c701:423c:b800:e516:82b3:32ae:664d","TCP","1466","0x018","294","","","443  >  49693 [PSH, ACK] Seq=174179 Ack=165 Win=294 Len=1392 [TCP PDU reassembled in 146]"
"143","0.115884","2a03:2880:f242:1c2:face:b00c:0:167","2a06:c701:423c:b800:e516:82b3:32ae:664d","TCP","1466","0x010","294","","","443  >  49693 [ACK] Seq=175571 Ack=165 Win=294 Len=1392 [TCP PDU reassembled in 146]"
"144","0.115884","2a03:2880:f242:1c2:face:b00c:0:167","2a06:c701:423c:b800:e516:82b3:32ae:664d","TCP","1466","0x010","294","","","443  >  49693 [ACK] Seq=176963 Ack=165 Win=294 Len=1392 [TCP PDU reassembled in 146]"
"145","0.115884","2a03:2880:f242:1c2:face:b00c:0:167","2a06:c701:423c:b800:e516:82b3:32ae:664d","TCP","1466","0x010","294","","","443  >  49693 [ACK] Seq=178355 Ack=165 Win=294 Len=1392 [TCP PDU reassembled in 146]"
"146","0.115884","2a03:2880:f242:1c2:face:b00c:0:167","2a06:c701:423c:b800:e516:82b3:32ae:664d","TLSv1.2","1466","0x010","294","","TLS 1.2","Application Data"
"147","0.115884","2a03:2880:f242:1c2:face:b00c:0:167","2a06:c701:423c:b800:e516:82b3:32ae:664d","TLSv1.2","1466","0x010","294","","TLS 1.2","Application Data"
"148","0.115884","2a03:2880:f242:1c2:face:b00c:0:167","2a06:c701:423c:b800:e516:82b3:32ae:664d","TCP","1466","0x010","294","","","443  >  49693 [ACK] Seq=182531 Ack=165 Win=294 Len=1392 [TCP PDU reassembled in 159]"
"149","0.115884","2a03:2880:f242:1c2:face:b00c:0:167","2a06:c701:423c:b800:e516:82b3:32ae:664d","TCP","1466","0x010","294","","","443  >  49693 [ACK] Seq=183923 Ack=165 Win=294 Len=1392 [TCP PDU reassembled in 159]"
"150","0.115884","2a03:2880:f242:1c2:face:b00c:0:167","2a06:c701:423c:b800:e516:82b3:32ae:664d","TCP","1466","0x010","294","","","443  >  49693 [ACK] Seq=185315 Ack=165 Win=294 Len=1392 [TCP PDU reassembled in 159]"
"151","0.115884","2a03:2880:f242:1c2:face:b00c:0:167","2a06:c701:423c:b800:e516:82b3:32ae:664d","TCP","1466","0x010","294","","","443  >  49693 [ACK] Seq=186707 Ack=165 Win=294 Len=1392 [TCP PDU reassembled in 159]"
"152","0.115884","2a03:2880:f242:1c2:face:b00c:0:167","2a06:c701:423c:b800:e516:82b3:32ae:664d","TCP","1466","0x010","294","","","443  >  49693 [ACK] Seq=188099 Ack=165 Win=294 Len=1392 [TCP PDU reassembled in 159]"
"153","0.116274","2a06:c701:423c:b800:e516:82b3:32ae:664d","2a03:2880:f242:1c2:face:b00c:0:167","TCP","74","0x010","8199","","","49693  >  443 [ACK] Seq=165 Ack=189491 Win=8199 Len=0"
"154","0.117262","2a03:2880:f242:1c2:face:b00c:0:167","2a06:c701:423c:b800:e516:82b3:32ae:664d","TCP","1466","0x010","294","","","443  >  49693 [ACK] Seq=189491 Ack=165 Win=294 Len=1392 [TCP PDU reassembled in 159]"
"155","0.117262","2a03:2880:f242:1c2:face:b00c:0:167","2a06:c701:423c:b800:e516:82b3:32ae:664d","TCP","1466","0x010","294","","","443  >  49693 [ACK] Seq=190883 Ack=165 Win=294 Len=1392 [TCP PDU reassembled in 159]"
"156","0.117262","2a03:2880:f242:1c2:face:b00c:0:167","2a06:c701:423c:b800:e516:82b3:32ae:664d","TCP","1466","0x010","294","","","443  >  49693 [ACK] Seq=192275 Ack=165 Win=294 Len=1392 [TCP PDU reassembled in 159]"
"157","0.117262","2a03:2880:f242:1c2:face:b00c:0:167","2a06:c701:423c:b800:e516:82b3:32ae:664d","TCP","1466","0x010","294","","","443  >  49693 [ACK] Seq=193667 Ack=165 Win=294 Len=1392 [TCP PDU reassembled in 159]"
"158","0.117262","2a03:2880:f242:1c2:face:b00c:0:167","2a06:c701:423c:b800:e516:82b3:32ae:664d","TCP","1466","0x010","294","","","443  >  49693 [ACK] Seq=195059 Ack=165 Win=294 Len=1392 [TCP PDU reassembled in 159]"
"159","0.117262","2a03:2880:f242:1c2:face:b00c:0:167","2a06:c701:423c:b800:e516:82b3:32ae:664d","TLSv1.2","1466","0x010","294","","TLS 1.2","Application Data"
"160","0.117262","2a03:2880:f242:1c2:face:b00c:0:167","2a06:c701:423c:b800:e516:82b3:32ae:664d","TLSv1.2","1466","0x010","294","","TLS 1.2","Application Data"
"161","0.117262","2a03:2880:f242:1c2:face:b00c:0:167","2a06:c701:423c:b800:e516:82b3:32ae:664d","TCP","1466","0x010","294","","","443  >  49693 [ACK] Seq=199235 Ack=165 Win=294 Len=1392 [TCP PDU reassembled in 171]"
"162","0.117262","2a03:2880:f242:1c2:face:b00c:0:167","2a06:c701:423c:b800:e516:82b3:32ae:664d","TCP","1466","0x010","294","","","443  >  49693 [ACK] Seq=200627 Ack=165 Win=294 Len=1392 [TCP PDU reassembled in 171]"
"163","0.117262","2a03:2880:f242:1c2:face:b00c:0:167","2a06:c701:423c:b800:e516:82b3:32ae:664d","TCP","1466","0x010","294","","","443  >  49693 [ACK] Seq=202019 Ack=165 Win=294 Len=1392 [TCP PDU reassembled in 171]"
"164","0.117262","2a03:2880:f242:1c2:face:b00c:0:167","2a06:c701:423c:b800:e516:82b3:32ae:664d","TCP","1466","0x018","294","","","443  >  49693 [PSH, ACK] Seq=203411 Ack=165 Win=294 Len=1392 [TCP PDU reassembled in 171]"
"165","0.117262","2a03:2880:f242:1c2:face:b00c:0:167","2a06:c701:423c:b800:e516:82b3:32ae:664d","TCP","1466","0x010","294","","","443  >  49693 [ACK] Seq=204803 Ack=165 Win=294 Len=1392 [TCP PDU reassembled in 171]"
"166","0.117262","2a03:2880:f242:1c2:face:b00c:0:167","2a06:c701:423c:b800:e516:82b3:32ae:664d","TCP","1466","0x010","294","","","443  >  49693 [ACK] Seq=206195 Ack=165 Win=294 Len=1392 [TCP PDU reassembled in 171]"
"167","0.117262","2a03:2880:f242:1c2:face:b00c:0:167","2a06:c701:423c:b800:e516:82b3:32ae:664d","TCP","1466","0x010","294","","","443  >  49693 [ACK] Seq=207587 Ack=165 Win=294 Len=1392 [TCP PDU reassembled in 171]"
"168","0.117262","2a03:2880:f242:1c2:face:b00c:0:167","2a06:c701:423c:b800:e516:82b3:32ae:664d","TCP","1466","0x010","294","","","443  >  49693 [ACK] Seq=208979 Ack=165 Win=294 Len=1392 [TCP PDU reassembled in 171]"
"169","0.117262","2a03:2880:f242:1c2:face:b00c:0:167","2a06:c701:423c:b800:e516:82b3:32ae:664d","TCP","1466","0x010","294","","","443  >  49693 [ACK] Seq=210371 Ack=165 Win=294 Len=1392 [TCP PDU reassembled in 171]"
"170","0.117262","2a03:2880:f242:1c2:face:b00c:0:167","2a06:c701:423c:b800:e516:82b3:32ae:664d","TCP","1466","0x010","294","","","443  >  49693 [ACK] Seq=211763 Ack=165 Win=294 Len=1392 [TCP PDU reassembled in 171]"
"171","0.117262","2a03:2880:f242:1c2:face:b00c:0:167","2a06:c701:423c:b800:e516:82b3:32ae:664d","TLSv1.2","1466","0x010","294","","TLS 1.2","Application Data"
"172","0.117262","2a03:2880:f242:1c2:face:b00c:0:167","2a06:c701:423c:b800:e516:82b3:32ae:664d","TLSv1.2","1466","0x010","294","","TLS 1.2","Application Data"
"173","0.117262","2a03:2880:f242:1c2:face:b00c:0:167","2a06:c701:423c:b800:e516:82b3:32ae:664d","TCP","1466","0x010","294","","","443  >  49693 [ACK] Seq=215939 Ack=165 Win=294 Len=1392 [TCP PDU reassembled in 184]"
"174","0.117262","2a03:2880:f242:1c2:face:b00c:0:167","2a06:c701:423c:b800:e516:82b3:32ae:664d","TCP","1466","0x010","294","","","443  >  49693 [ACK] Seq=217331 Ack=165 Win=294 Len=1392 [TCP PDU reassembled in 184]"
"175","0.117262","2a03:2880:f242:1c2:face:b00c:0:167","2a06:c701:423c:b800:e516:82b3:32ae:664d","TCP","1466","0x010","294","","","443  >  49693 [ACK] Seq=218723 Ack=165 Win=294 Len=1392 [TCP PDU reassembled in 184]"
"176","0.117262","2a03:2880:f242:1c2:face:b00c:0:167","2a06:c701:423c:b800:e516:82b3:32ae:664d","TCP","1466","0x010","294","","","443  >  49693 [ACK] Seq=220115 Ack=165 Win=294 Len=1392 [TCP PDU reassembled in 184]"
"177","0.117262","2a03:2880:f242:1c2:face:b00c:0:167","2a06:c701:423c:b800:e516:82b3:32ae:664d","TCP","1466","0x010","294","","","443  >  49693 [ACK] Seq=221507 Ack=165 Win=294 Len=1392 [TCP PDU reassembled in 184]"
"178","0.117262","2a03:2880:f242:1c2:face:b00c:0:167","2a06:c701:423c:b800:e516:82b3:32ae:664d","TCP","1466","0x010","294","","","443  >  49693 [ACK] Seq=222899 Ack=165 Win=294 Len=1392 [TCP PDU reassembled in 184]"
"179","0.117262","2a03:2880:f242:1c2:face:b00c:0:167","2a06:c701:423c:b800:e516:82b3:32ae:664d","TCP","1466","0x010","294","","","443  >  49693 [ACK] Seq=224291 Ack=165 Win=294 Len=1392 [TCP PDU reassembled in 184]"
"180","0.117262","2a03:2880:f242:1c2:face:b00c:0:167","2a06:c701:423c:b800:e516:82b3:32ae:664d","TCP","1466","0x010","294","","","443  >  49693 [ACK] Seq=225683 Ack=165 Win=294 Len=1392 [TCP PDU reassembled in 184]"
"181","0.117262","2a03:2880:f242:1c2:face:b00c:0:167","2a06:c701:423c:b800:e516:82b3:32ae:664d","TCP","1466","0x010","294","","","443  >  49693 [ACK] Seq=227075 Ack=165 Win=294 Len=1392 [TCP PDU reassembled in 184]"
"182","0.117590","2a06:c701:423c:b800:e516:82b3:32ae:664d","2a03:2880:f242:1c2:face:b00c:0:167","TCP","74","0x010","8199","","","49693  >  443 [ACK] Seq=165 Ack=228467 Win=8199 Len=0"
"183","0.119772","2a03:2880:f242:1c2:face:b00c:0:167","2a06:c701:423c:b800:e516:82b3:32ae:664d","TCP","1466","0x010","294","","","443  >  49693 [ACK] Seq=228467 Ack=165 Win=294 Len=1392 [TCP PDU reassembled in 184]"
"184","0.119772","2a03:2880:f242:1c2:face:b00c:0:167","2a06:c701:423c:b800:e516:82b3:32ae:664d","TLSv1.2","1466","0x010","294","","TLS 1.2","Application Data"
"185","0.119772","2a03:2880:f242:1c2:face:b00c:0:167","2a06:c701:423c:b800:e516:82b3:32ae:664d","TLSv1.2","1466","0x010","294","","TLS 1.2","Application Data"
"186","0.119772","2a03:2880:f242:1c2:face:b00c:0:167","2a06:c701:423c:b800:e516:82b3:32ae:664d","TCP","1466","0x018","294","","","443  >  49693 [PSH, ACK] Seq=232643 Ack=165 Win=294 Len=1392 [TCP PDU reassembled in 196]"
"187","0.119772","2a03:2880:f242:1c2:face:b00c:0:167","2a06:c701:423c:b800:e516:82b3:32ae:664d","TCP","1466","0x010","294","","","443  >  49693 [ACK] Seq=234035 Ack=165 Win=294 Len=1392 [TCP PDU reassembled in 196]"
"188","0.119772","2a03:2880:f242:1c2:face:b00c:0:167","2a06:c701:423c:b800:e516:82b3:32ae:664d","TCP","1466","0x010","294","","","443  >  49693 [ACK] Seq=235427 Ack=165 Win=294 Len=1392 [TCP PDU reassembled in 196]"
"189","0.119772","2a03:2880:f242:1c2:face:b00c:0:167","2a06:c701:423c:b800:e516:82b3:32ae:664d","TCP","1466","0x010","294","","","443  >  49693 [ACK] Seq=236819 Ack=165 Win=294 Len=1392 [TCP PDU reassembled in 196]"
"190","0.119772","2a03:2880:f242:1c2:face:b00c:0:167","2a06:c701:423c:b800:e516:82b3:32ae:664d","TCP","1466","0x010","294","","","443  >  49693 [ACK] Seq=238211 Ack=165 Win=294 Len=1392 [TCP PDU reassembled in 196]"
"191","0.119772","2a03:2880:f242:1c2:face:b00c:0:167","2a06:c701:423c:b800:e516:82b3:32ae:664d","TCP","1466","0x010","294","","","443  >  49693 [ACK] Seq=239603 Ack=165 Win=294 Len=1392 [TCP PDU reassembled in 196]"
"192","0.119772","2a03:2880:f242:1c2:face:b00c:0:167","2a06:c701:423c:b800:e516:82b3:32ae:664d","TCP","1466","0x010","294","","","443  >  49693 [ACK] Seq=240995 Ack=165 Win=294 Len=1392 [TCP PDU reassembled in 196]"
"193","0.119772","2a03:2880:f242:1c2:face:b00c:0:167","2a06:c701:423c:b800:e516:82b3:32ae:664d","TCP","1466","0x010","294","","","443  >  49693 [ACK] Seq=242387 Ack=165 Win=294 Len=1392 [TCP PDU reassembled in 196]"
"194","0.119772","2a03:2880:f242:1c2:face:b00c:0:167","2a06:c701:423c:b800:e516:82b3:32ae:664d","TCP","1466","0x010","294","","","443  >  49693 [ACK] Seq=243779 Ack=165 Win=294 Len=1392 [TCP PDU reassembled in 196]"
"195","0.119772","2a03:2880:f242:1c2:face:b00c:0:167","2a06:c701:423c:b800:e516:82b3:32ae:664d","TCP","1466","0x010","294","","","443  >  49693 [ACK] Seq=245171 Ack=165 Win=294 Len=1392 [TCP PDU reassembled in 196]"
"196","0.119772","2a03:2880:f242:1c2:face:b00c:0:167","2a06:c701:423c:b800:e516:82b3:32ae:664d","TLSv1.2","1466","0x010","294","","TLS 1.2","Application Data"
